"review_id","user_id","business_id","stars","useful","funny","cool","text","date"
"VO4mwniB5bfi6xQ911CQ1A","U5sxlWgMKK1GOFeGYHNg8Q","q5SkKR6VbdVyaY8ToapZ-A",5,1,0,1,"I'm completely obsessed with Crossfit Zionsville!! I've always been fit and an avid gym member but after trying out crossfit I really saw a new level of fitness. The atmosphere is like no other gym I've ever been to. Everyone supports everyone and you feel like one big family. We cheer for everyone until the last person finishes. I've never felt so accomplished and empowered after a workout like I do when I complete a workout here. I'm coming up on my 3 month mark and I feel so much stronger not only from when I started but in my whole life. I strongly encourage anyone to come try out a class. You'll love the workout and you'll definitely love the members, it's a place you will never forget.","2013-05-17 14:37:02"
"_1yp8OruOXT-3FzKOCmqwA","Dve-YlOJrITNlDsRTCNR0w","BVXb9Ed_wxPR9Av0NNs_6A",3,0,0,0,"Super bummed out. Second time at this salon and my pedicure services were great but when I got my full set my nail person kept filing at my skin and I showed visibly I was in pain and kept pulling away and now I'm left with broken skin. He saw he broke skin but didn't apologize or take any interest in what he'd done. If I do come back, I'll never go to this technician again.","2017-08-30 13:03:30"
"hiD3F8zIeSHiSp_2aoMemQ","jDB9w9fUj-eSQeJo8JAQ1g","R77LwVI3wPAFmDLrXt3zZA",5,0,0,0,"The cook is so fun he comes out to explain the desserts and the different things. He makes the dressings, most the meats, soups, and the desserts by himself. The gooey butter cake is my favorite! This is a must try!!!","2017-01-17 17:39:48"
"CXGLIpaYZp3X6y7s7zmLlQ","VkHcPJMAsXKat_q9fsq2aA","Bw0cpnfI-Y9QmjWzqS-oFg",5,1,0,0,"Love this place! Everything tastes so fresh. Ordered the sashimi sampler platter and was blown away by how great everything was.","2010-05-24 15:54:43"
"4WYDMnLZ0Tz92cqKQPzbIw","I58REsk6EZIwkd_4R7jcZA","pj8Y-5vfbRitnnm2xJFH9w",1,3,0,0,"This place is the pits. I went there with a medium-sized party (with reservations) and sat outside. The waitress screwed up nearly everyone's orders, the service took more than an hour (not counting the time AFTER we got the wrong foods it took for her to get the people who even cared to wait longer their correct orders), and the stuff we were told was ""spicy"" was fairly mild. My spice-phobic friends ordered a green salad, which they were not warned (but told afterward by the waitress) is ""the spiciest thing on the menu."" We were charged an entertainment fee and a BYO fee PER PERSON for them to give us a bottle opener. All in all, possibly the worst dining experience I've had in Philly.","2009-03-04 17:47:55"
"p7oy4t0SbgWt32Pitzg_3w","3s29rO3QzuBWpWBDDs4lIg","Q3udDlBSVCvZSqsFtIgMLg",5,0,0,0,"They went out of their way to help (we worked with John, the retail manager).  The hours are great, and they have a giant selection of menswear.  They listen to what you are telling them and get you things based on how you like what they brought you previously (size up or down, different style, etc). If you are buying a tux or suit, they may even do some quick tailoring while you wait so you can walk out with everything you need all set to go (they did this for us as well as the person before us).  They are quite helpful on working within your budget as well, if you have one.  Worth a stop for sure!","2016-02-14 05:00:17"
"XhPwjLXM7nSVHhU7R8NT8Q","45XctmHcotxwzqCmvLQxkQ","Z5po0aTuzKKblek5y6Sp8Q",2,0,0,0,"Tried this place a few days after opening. I'd get into a lengthier review, but everyone else has taken care of that.  IMO, 5 guys is far and away the best. This burger was very dry, and not very tasty. Fries are OK. I think when all the hype dies this place will be forgotten.","2010-03-28 19:46:17"
"xCAXGuMn6cCnzJbHKiv0lw","ka7MiMRkRFemGw6RMkg0UA","gCcJTKC40CL0XtYYGfcXDw",5,0,0,0,"Smiley's Cafe is AMAAAZZZIIINNNGGGG ! If you're looking for a place with great food and great service this is the place to go! Guarantee that you will leave this place with a smile! I'm addicted to the Sweet Blackberry Smoothie & the Baklava & his chili !  I can just keep going & going! 


OH & the prices are great (:

- Sincerely the girls at Greene Street! 

Love you Smiley","2014-01-04 23:27:53"
"ldSTw4evwbSKo3J9p3xHtw","oBhQMjrT0zdSLdlybWRA_w","klGvxx2XmKkd-9mdRZoGVA",3,1,1,0,"This is very impressive, and the many lighthearted aspects to the ongoing video make it fun.  I don't know that it's worth going out of your way to see, but it's worth a stop if you're within a few blocks, especially at night.  The building itself is pretty, and be sure to look up to see the numerous statues of people walking on the support beam.","2014-04-19 18:38:06"
"IOYXlC2y8hsvEnDNuckNeQ","uONRjAsiMfnPY1RSM7zB1w","yE1raqkLX7OZsjmX3qKIKg",5,0,0,0,"My husband and I came in on a Sunday night and caught a guest chef collaboration. We ordered all 16 of the items on the mezze menu and enjoyed all of the very well blended, interesting flavors...especially the turnips, everything beets salad, the pickled celery with sour cherries, and faint anise flavored corn. The feta dip was tangy, hot and sweet at the same time. The surprising crunch in the hummus and as the other reviews mention, the pickled shrimp was really delightful. The jalapeño melon salad was my favorite light and spicy and sweet.

The highlight of the meal was the grilled octopus with a light, lemony sauce and the CRAB BEIGNETS!!!! That's right, the guest chef was from New Orleans. Justin Devillier from The Petite Grocery. The flavor, the slight crunch of the corn sauce was the perfect end to a perfect meal. 

The service was excellent per Ruby.  Would strongly recommend.","2017-07-31 02:07:58"
"FrVgm2ANTbzbrseawLmWkg","M5oKq5yiSIgMopLf5G1RJw","9uHEhLKTVXATCt7JSvUsCg",5,0,0,0,"Will go there every time I visit Philly. I like how you can taste the pineapple in the water ice. (even though it taste like the can pineapple) It's also really cheap so you can get one for yourself and not have to share.","2015-09-02 15:51:16"
"AS9yGbzdWxSfy8Ly9m8ykg","ObZnTiwMA-4gaTqa1_mB6A","TUH-FGpkOKCOVGIzmtTtfg",4,0,0,0,"Place is very nice and clean. Service is friendly and welcoming. We had about 3 different people serving us that made us feel very welcomed. The menu had plenty of choices for the two of us.
We started the dinner with the burrata and risotto cakes. The cheese was decent. Lacked a bit of salt for our taste buds but we still ate every last piece. The risotto cakes were very heavy on the breading and lacked flavor. We next shared a salad and the tomato soup. The soup was some of the best we have ever had and was our favorite plate of the night. The salad was fresh and bright. The main dish consisted of Rigatoni for me and the wife had seafood paella. The chicken meatballs in the rigatoni were tough, dry, and not desirable. The pasta and sauce were great. The paella was tasty with a good selection of seafood.
We finished the evening with a chocolate mouse tarte. The little dessert was full of great flavor.
I would recommend Richard's to anybody looking for a great night out. Service is great. overall flavors are solid. 
Cheers Always!","2018-01-22 00:45:41"
"Bv1Kv9h70gwv9oY_N97xfw","oivvtlA_rIxXlTXDd7LUYQ","sqc0XZr0CZSmqb7Rw8skCQ",5,0,0,0,"If you have the choice to pick your location, this is the best pasta house! Arnold went down hill after their remodel and I drive out of my way for this location. Their pasta is actually creamy and not dry. You can actually order it to go and it's still amazing when you get home. They use plastic containers not styrofoam containers which make your food taste weird.","2017-07-29 04:23:53"
"aA2tsG21-4Bt0Ka3u4a3gw","-DA253kDz0HJ2RHvj06vDg","VO5Jphyqmoa62lbA7-vzpQ",5,1,0,1,"This theater is great, shows are always good, old style melodrama so the audience really gets into it booing and cheering the actors on. We have been to several shows and haven't been disappointed with any. Little Anthony's restaurant is a great place to eat before a show or any time your in the area.","2015-12-23 02:40:03"
"IXu6G5Yxy_goY6r65R8flg","J5UplcR8Txw8fmUm_4VifA","6LyhttbsQn6a6PDxQDojCw",5,0,0,0,"I have been here twice and all I can say is ""OMG"" because the food is so good. We have had several dishes and they all have been amazing. The service has been 5 stars as well. This is probably one if not the best Japanese restaurant in the area. 

After I finish eating, my next thought is I can't wait till I can get back to try something else.","2017-11-10 22:59:25"
"UOCgOewFVlGiPUeQQxXOFw","ykVdeBONaLNFp6Xw6Xhn4w","WfPmZ9hp50ttugTVgfcPpA",4,0,0,0,"Great spot for pizza and sushi alike. 

The Margherita pizza and Cesar salad have become a staple for hubs and I. Also, ordered a large Hawaiian for girls night and it was a huge, literally, success. 

Dine in or delivery are both great options as service is prompt and friendly either route. 

Side note: Superb sushi (the sushi provider at lulus) downtown is closed on Sunday (along with most other sushi joints), so if you're having a craving run over to Lulu's!","2014-11-20 01:10:41"
"MA0Yo-6aW1Wi0ILxNOgtEg","DMwp6ZDmshHRPeQVrYGoqQ","tYqIKRQjDCywDVkbfUGSug",4,0,0,1,"I needed to find a place to pick up some cookies or something for a potluck and found myself in this neighborhood. Thanks to my fellow yelpers, I found this bakery. We got about pound of cookies, as well as some of their famous cinnamon rolls and sticky buns. They also had cannoli that looked yummy, but we decided we had enough. The cookies were delish and were a big hit. The buns and rolls were good, although the cinnamon roll's glaze was a little too sweet for my taste. Great local bakery.","2016-07-27 01:59:17"
"tBZxpN-byiDdE23H4UlU-Q","JRDBda4rcrwRH8zBPbByrw","oGdbvXKXVCQ8WC_GQePDkQ",1,1,0,0,"Quaint charm can only get you so far in the restaurant business. 6 of us decided to have breakfast here this past Saturday and couldn't have been more dissapointed.  Burnt bacon and toast, hard dry biscuits, cold signature potatoes that were unevenly cooked, fruit bowl ordered but not delivered, syrup that had to be specially requested for French toast, were just the beginning. Discussion afterward revealed that 2 members of our party had eaten here before and weren't satisfied but didn't want to prejudice the rest of us in case it was just a fluke. I wish they had said something. We won't be back.","2016-05-08 13:14:41"
"4kTmuyO1AxcW-0ZB6pnPWg","mRwIG78jQASvVLPYf2A2gA","I9DCtzUgR4gamBFMVsdY8g",4,0,0,0,"I think capital beer is pretty ok to me. I dont have any complaints other than maybe price but that doesnt really bother me that much with this place. Ill go here once a week or anytime im craving sushi its always pretty good. Chinese food is standard. Great beer selection take your pick.","2016-11-14 02:04:34"
"ucE9fhL4ApDOmmYqnRHDJg","vFIIeMEHtBQdApYCLF73AA","K8b2MQ5Az59-nzvqUfjJEQ",5,6,1,2,"Short of it:
BYOB & no corking fee. Everything is delicious, but if I had to put in order of what I thought was amazing to great: Bloody Beet Steak, Salted dark chocolate napoleon, Spice encrusted trout and new jersey risotto with lions mane mushrooms. I can't say for sure where the roasted winter vegetable salad sits within the list since it wasn't my main dish - but I would say top 3. 

The details:

The boyfriend and I decided to have one nice dinner while enjoying an impromptu weekend vacation to Philly. Neither of us had been before and this was truly a highlight of the weekend.

Bloody Beet Steak: Holy Beets. This set the tone for the rest of the meal. This was perfectly balanced - sweet, acidic, fresh, light...I wanted to bury my face into this dish. It's been a while since I've wanted to lick a plate clean. But luckily they give you brioche buns and butter in the beginning so I used that as a vessel into my mouth. 

Roasted Winter Vegetable Salad: It was a hard choice between this and the Beets for me, but luckily my boyfriend got it which was also surprising because he doesn't normally like cauliflower. So is it wrong that I was hoping that he just hated the taste so much that I could have two first courses? Unfortunately for me, he found it delicious and so I was only blessed with the tiniest of bites as he scraped up the rest of the vegetables. The bite was just as well balanced as the beet steak and to be honest, if I could eat vegetables like this more often I think I could be a vegetarian.

New Jersey Risotto with lion mane mushrooms: I'm sure this was possibly called something else, but I remember specifically the waiter mentioned that the risotto comes from Jersey and the lion mane mushrooms came from a local farm near philly. The risotto was done perfectly, and had bits of black truffle along with the lions mane mushroom. The taste of the mushroom

Spice encrusted trout: I'm always hesitant about spice encrusted things. Like, is it going to be overly salty/browned/overpowering that it destroys the flavor of which it is encrusting? But I took a chance, and I'm glad I did. The spice that encrusted the trout was coarsely ground so it gave a beautiful contrast to the meaty fish. The parsnips below were so delicious and sweet which went well with the whole dish.

Salted Dark Chocolate Napoleon: Whenever I go to restaurants, my thought is always ""yes to chocolate"" regardless of how full I am. This isn't your traditional napoleon, the phyllo dough was crispy thin and touched with honey sitting layered between salted dark chocolate mousse topped with white chocolate cream encircled by a caramel sauce. It was exactly what I needed at the end and was surprisingly light.

Bonus points: The chef worked at one of my favorite restaurants in NY.","2015-01-04 23:16:30"
"Jol31h5Y0xTB4mLQHpKLlA","dF9DauP27z5pZRns-AGcPw","AfassS1QI0DHsqwuof9-lA",4,2,2,3,"Wow did some do a review and say 7 dollars a pitcher, i remember when it was 5, and dollar mugs of lager, thats still cheap though. I haven't been there in awhile, but Its one of the few joints I know that has an old style jukebox, full of good shit, where you can play a single song for a quarter. Wait they might have a new jukebox now, hmm I forget. I remember going to a Dirty Franks picnic in Fairmount Park way back when, they had lots of BBQ, lots of beer, and they had a treasure hunt in the woods for little liquor bottles. I remember being really bad at volleyball that day. I also ran into one of my college professors that day. That was kinda funny.","2007-06-15 18:07:10"
"u6r_FZPdnugRpb2TrPH0Ng","Bok4NoUX0nRQP-OePPivdA","04UD14gamNjLY0IDYVhHJg",5,0,0,0,"Succulent seafood and fresh vegetables in ample portions. I would eat here every day if I could afford it.  You must try the octopus. Perfect for both an intimate date or a big group, as the menu accommodates adventurous eaters and the simple sort and dishes can be shared or devoured individually.   
Plan in advance or prepare to wait, unless you are an early eater.  No reservations. The queen village location is the smallest, and you may have better luck snagging a spot at the NoLibs location.","2012-12-11 01:30:55"
"tYojZ8BEQKT9paVU1vY9xg","bWfU-XOaVHOsNAfLIJtA3w","yeHLiKNp0hyR-ig4M6us-w",5,1,0,1,"Excellent food and a great value! My date and I split an empanadas order, two drinks, and a main, with dessert, and it only came to roughly 60 total. There are plenty of options and you won't be disappointed. Just remember 3 empanadas coke per order, one is plenty, two will fill you up. Highly recommend.","2017-08-01 02:07:21"
"TCxLkP6kJ5t0a2fmDXFRrw","OEevH-Cv_JFHgvurUziJdA","xVgrzXaOky9Lo0f3NgZCmA",5,0,0,0,"This is my second time staying in a Hyatt Place hotel and I remain impressed. 

My boyfriend and I got a one bed room, and it was very spacious. Definitely more than enough for two people. There was a comfortable sectional sofa, a desk and chair, large tv, full length mirror and closet, two sinks and plenty of counter space. Although the bathroom was a bit cramped, the shower stall was clean and roomy. Wifi is free.

I definitely miss the bed. I never thought I'd say that about a hotel bed. It was so comfortable and soft. I slept so well because my body would literally sink into the mattress. The pillows looked kind of lumpy but they were surprisingly just as comfortable. 

The breakfast was delicious! Definitely the best hotel breakfast I've ever had. The food was fresh and yummy, and there was lots of variety. 

There is also a cafe in the lobby that sells pastries and drinks. You can also order food 24/7 from a menu in your room.","2013-04-17 02:11:27"
"cf-UKxlLjiMjbPELdRvXRQ","xvqX_pdlxzw0EsDqTx6DsQ","9_m_iA3VAqGBJEW5XLc-5w",5,0,0,0,"I've been here several times over the last few years and have always walked away with a happy, full stomach. The Cuban sandwiches are perfectly pressed and are enough for a whole meal by themselves, but the pastelitos are to die for and the café is strong, so come with an empty stomach to be able to fit these delights in. 

This place was originally teeny tiny without much seating, but it seems like other people liked it as much as I did, so they've expanded their seating into another room, which is brightly decorated and cheery. Overall a refreshing, lively vibe from this joint and one happy customer!","2017-03-18 02:06:15"
"--ltCX8sqFpqksFIRVv3lA","kkT2hjZ_TO-1yKdU2y0vKw","M2ZrrqseHE5xssUrOL0Gtg",3,0,0,0,"This little gem is open 24 hours and has become one of my frequented late night spots.  The Southwestern Burrito Wrap has been my go-to lately.  The Belgium Waffles are another favorite of my family.  Corn beef hash with eggs is not the best I've ever had, but it hits the spot at 4 am after a night of drinking. 
 I can understand why the place stays hopping 24 hours.  The price is right for a decent bite to eat, day or night.","2013-10-28 23:04:53"
"bmEISp0qxFGCy-o3dUMqRA","UajLAdOWm21mz_Z0vhu8Rg","qxDVtIq0EtvOtVKDwbYOiQ",1,0,0,0,"I love Roma burgers, I try to have one in every city I visit but this location butchered the Roma burger. Over cooked the usually mouth melting burger so it was tough. Over toasted the bun so it was tough.
A shame. Next time I will try a different location.","2016-07-25 20:24:52"
"TSO_28pihFwxlmeURTzKYQ","ZypLQ5F8aSfqqVNXhb-7Qg","jMZ56S8Y1t7cA1Ob-d-qeA",4,0,0,0,"Wanted to start close to the airB&B I was staying at so I wondered down to this gem. My favorite here was the live music with pianist. The cocktail I had I believe was ""The Muse"" and it was delicious. Love the environment friendly paper straws too! I did try the Bleu cheese stuff dates and honestly was not a fan. Didn't taste like there was cheese in there at all and the bacon that wrapped the dates tasted too burned for my liking.","2018-09-26 13:50:42"
"tord9YirmW6sJSAdERQDmg","pOp_bilS11Zd0yJvBMge1Q","w520vYWEpEYBf90rSr9NVA",5,0,0,0,"Hands down the best thai food in Nashville, or maybe that I have ever had. My brother lives in Thailand and he said first hand it was VERY authentic! Also, don't even hesitate what you're going to order - get the Pad Thai. It's not the Pad Thai you're probably used to, which is a GREAT thing. This dish leaves out the Americanized ""doused with sauce"" style, yet keeps all of the flavor. You may want to get there earlier because there will be a wait, as the inside only seats about 25 people. Worth the wait if there is one, the staff is also VERY kind!","2015-08-20 17:18:57"
"UDJAlDc2YMVpcs38zM3YSA","5bJpDx4c7x9fYzdltOhfbw","7mpYTDb24SywNMRn3yeakQ",5,2,4,0,"I'm so glad that my friend who lives nearby Twisted Tail took me here! I will be back because I had a great experience. The service is friendly, the atmosphere is very warm and welcoming and the drink list and menu have something for everyone to enjoy. 

I was here on a Tuesday night and there was an autistic performance from Niki Sbaffoni and she was wonderful! The music really added to the southern flare of the place. 

Their mixed drink menu is amazing. Try the Kool Kat! It's made with fresh cucumbers and pear vodka. It's a perfect refreshing drink. I also ordered a cobb salad and it was delicious. It was in the appetizer section but it filled me up enough to be a full meal. The ranch dressing it was served with was a new recipe house-made and very tasty. 

Go here and you will def. want to go back too!","2013-03-20 17:22:21"
"IJQIfOjEg6Lg_OcMiELdlA","p3r6tBDBQjtYB8imkV87qw","QyMoP9r9KTht-r54EL2elQ",2,1,0,0,"I hate to say it, but other reviews were right. Burgers were decent, onion rings inedible due to grease, my kid's fries needed to be pressed with napkins, and the service was terrible. Service was... terrible. Waited over an hour with a 3 year old for our burgers. I love their wings, but don't think I'll eat in there again. We actually tipped another server that took care of us. I think ""Ryan"" was his name. Place was not busy when we got there.  Damn it! It's so close with such a good beer selection! Sorry, ""Pub""... you're almost there, but need some efficiencies put in place or a talent review.","2018-02-03 19:35:56"
"6aLsKccNv93RMQG6tONclA","eXNLiYN57fJZegEED3lv6g","T5f-IRQWQYgFQbgO_kVkvg",1,3,0,0,"This place is overpriced and the food is awful. We had Chicken Pot pies that were small and dried up. The doughnuts were stale. The place is also in poor condition and disorganized. This was a poor groupon and a waste of money.","2011-02-22 00:20:45"
"dt9jcYnkb8lh-mfEZjO35A","xxcdCt3QKvcaM4oQz7pG8w","P61ecBVVPgBm-zH_SYq8FA",4,0,0,0,"Very cool and unique hotel.  A little hard to get around the hotel's maze of wings and floors.  Staff is friendly but could have more employed/working because when we asked for sheets for the hide-a-bed, it took about 45 min. for someone to deliver them to us.  Fitness room is very good!","2016-12-11 01:16:21"
"3scxNiSKv9xWwYrPNdd6hw","e5WEN4JC0_p8mgLWwkmkIw","PBtZNTQl5tRReeC8It1G7g",2,3,0,0,"Wow, what a disappointment. It's a pretty building in a pretty place, hence the 2 stars. The service was terrible. I very rarely leave a bad review but this place deserves it. When I booked the room it was for 2 people and their ""bay breeze package"" but when I got here I was told the reservation was only for 1 person. This resulted in an additional charge of over $50 to add my daughter back onto the package. Since it was my first time at the hotel and it was their error, I asked if there was a comp- 1 front desk person and 2 supervisors later I was able to get 1 free drink at the bar for a house brand drink. Really? All that work for a $4 glass of wine? When my daughter's cold got worse and then she couldn't use the additional service I just paid for, neither the hotel or the spa would work with us to rebook the service, issue a gift certificate or anything else. The room was ok, nothing special. The hot tub and pool were ok, but creepy later in the evening due to poor lighting and minimal staff. Save yourself money and stay some other place that is more customer oriented.","2017-12-03 13:29:48"
"cIBRdoAnPHwEzwxlnq495Q","vn5qiAq8uihNPapCv6FJqA","9xm4aIAT_xwRoTxc0_8AWQ",5,1,1,1,"Awesome! Stayed here for 3 days and never had a problem. The staff are very friendly and will work with you to make your stay pleasurable. The breakfast was good but they had the same stuff every morning. My last morning there they were talking about making other food to switch things up. The rooms are very comfy. I've upload pictures of the studio suite i stayed in. I also took pics of the lobby and the kitchen area. Hope everyone enjoys their stay here like i did!","2013-09-07 02:51:33"
"T_x2i7uiQwIP0kq-2HsZLQ","KWLxxZKAcdUOBqBLMPW22w","-y5vYOsyL4bSFxeOtQtYbg",4,0,0,0,"We love AJ's! The specialty food selections are outstanding. We love to get a light dinner and eat on the patio. Tonight we enjoyed soup and salads. The service experience at the deli counter is sort of hit and miss. Tonight they were understaffed.  We will be back.","2016-04-24 02:11:38"
"sInPqEWG3vhGTKqv41CxuA","EcciFLxhzLzLgJR1QGMVvg","1T9F7iLDFAYWJvif1RKneg",5,2,0,1,"Saigon is one of my favorite first choice of  Vietnamese restaurants, I have been going there for so long ! great atmosphere, good food, very clean, great service. The owner is very nice, he remembers how I want my food to be cook. One of their best plates is Cm sng, super smokey grilled pork chop over medium egg, meat loaf & grilled shredded pork. It served Yasmin's rice with pickled carrots and daikon radish, of course yummy fish sauce with hot chili pepper. definitely recommend for people who first time want to try Vietnamese food. 
They also have bubble tea if anybody is looking for some smoothie, also special Vietnamese hot coffee great","2015-02-05 05:11:18"
