"review_id","user_id","business_id","stars","useful","funny","cool","text","date"
"OjzzYk6RTHhhbglbXUqiBQ","ILQP-O68qWK3r4eNgfrWtQ","d9eI_GFFIvR22f63Jt1MtA",5,1,0,0,"RowZone is a full body workout that is highly effective and never boring. Cardio on the ERG, weights and AB exercises make it the most efficient 45 minute workout I have ever done. And, the instructors (Laura in particular) are all professional and motivational. It feels like personalized instruction!","2015-02-03 22:37:43"
"DqdwVBoSxfmKDI6bTFhS7g","DhUEuSrGJfONLDixnP3YkQ","mUIBtlWNPD7sz3rGGWQ1RA",5,0,0,0,"I had spotted Kanella awhile ago when walking through that part of town, never heard of it. Read the reviews on yelp and definitely wanted to try it. We had brunch here at 2pm this past weekend and it was a stellar experience. The restaurant was beyond packed and busy, yet service was still attentive. The smell coming out of this place is intoxicating.

We had a really nice bottle of Stag's Leap Chardonnay and ordered savory brunch items. We shared theTachinosalata Platter to start (tomato salad, warm hummus, pita, felafel).  I had a spiced Mahi over couscous with preserved lemon and varied chopped ingredients. My friend had the clams and mussels penne special. I ordered a dessert that was offered as a special I believe. It was a lemon greek yogurt with a raspberry coulis. It was delicious. 

The dining room is warm and cozy. Yes, it is tight. Yes, it can be loud. The food is the real star here. Everyone sitting around us had amazing looking food as well.

I was really impressed with this place. I cannot wait to go back. It offers something authentic and special.","2010-12-10 00:22:41"
"rOvgFYA_KDiQDGAgla2Lvw","qa2Ew2jvf-LFOSv01G3gnQ","KZW_CVB-8pmIGYX_UVmsqQ",5,1,0,0,"Sandy is awesome!  1st time here.  I had a great experience!  Sandy didn't rush and really took her time to do a great job!","2015-12-11 15:38:40"
"CBIWaY9REAkOz_psdc7lww","D8CF2H3DYtNJlzR0IITMHQ","ugNplY4SZqIfP417oUxahQ",3,2,1,1,"Tried Chick-Fil-A (CFA) 6 times since opening. First time breakfast sandwich (see previous review), another time breakfast sandwiches for my previous employer, 1 time grilled chicken sandwich, 2 times the fried chicken sandwich solo, and meal, and last time was the chicken tender meal. 

I like the Lemonade (5 stars), small upgrade charge if you buy a meal, and they REFILL the Lemonade! I like the waffle iron fries, when they are cooked longer they are 4 stars, otherwise, 2.75 stars. The chicken, it's good, but the servings seem so small with the best being the fried chicken sandwich. I got the 4 pc tenders, and it's like get 6 McNuggets. If the Chicken was organic, it might make a bit more sense, but still would feel pricey. 

I am not a Fan of CFA, and I think the strongest reason is I am a Caniac, eating there at least 1 time per week, sometimes 2x a week for over 1 year now. I always crave it, and I am always happy with what I get. CFA is just okay, last night after getting my tenders, I looked and tasted, and I was 100% craving Cane's, so I went today. If you read my reviews, I have a place that usually adore, and if I go somewhere that doesn't do it like my #1 spot, I have to get to my #1 and get a fix for the experience that was not up to Par! 

At Cane's you get about 4-5 times as much chicken for a MUCH LOWER price! CFA is still busy, and I am not getting it, unless they are just experiencing. I don't see this current busyness as sustainable, and here's why, they close at 9PM daily, and are CLOSED on SUNDAYS! 

I think that's a cool idea, but that reminds me of 30-40 years ago thinking, and I am sure they are losing SERIOUS $$ with this policy, especially in Nevada. We are 24 hour town and 7 days a week, these hours (close at 9PM) and time (M-Sa) don't work. If they change to 24 hours (drive thru) and open 7 days a week, I can see them being a success permanently. Also they need to create a buyer's or VIP club, especially with the small chicken servings.","2017-08-12 06:51:45"
"ZCLCfVUjV-nlExlljLZxIA","r05Pr0OI4hkKdPS0bn9IDA","Uu7jwsfsaU-VJrV8Kpb4uw",5,0,0,0,"Curry chicken salad wrap with crisp veggies and fresh organic fruits.  I actually died.. it was that good.  The coffee is delicious and it is nice to have agave syrup as a sweetener option.  This is my favorite place in Phoenixville  for fresh fast eats.","2011-07-31 12:58:18"
"Hg7Qgb7iYGdw5QXqBEduvQ","v2TAq2PfbwOgYVlPbjLJjg","PY9GRfzr4nTZeINf346QOw",5,0,0,0,"WOW....

This place has come a long way. We got a suite overlooking the pool. It was fantastic. Huge paintings on the walls, separate shower with multiple shower heads, nice TV'S and great Casino action.

Staff is friendly and they just upgraded the poker room.

Who says the economy is suffering hasn't been here.","2012-07-19 20:57:41"
"GE1PvRDq0daP9UFcsdrmNA","mlTN5YVzzSk0etZFuD7eRA","_GP3RQvidO0XDSsd_4wfvw",1,3,0,1,"DO NOT shop there! Driver decided to drive off with out fridge- after 4 hours on the phone resolution was a 10% coupon and delivery... In 4 days!!
Worst experience ever! Unprofessional and rude! Would never shop there again. Beware!!","2014-04-20 01:02:54"
"NeUNGoiYfpLZSqhF_vdUIg","qFnOBrQBauci1j8YmmhK4g","m5-FtgWRd4qA7j0vaOXiXQ",4,0,0,0,"I am really glad that I did the Preservation Hall experience during my short time in NOLA as I think it gave me an authentic jazz experience.

They have three shows at night (8pm, 9pm, and 10pm). We arrived for the 10pm show 40 minutes early and barely got in. For 40 minutes, we waited outside. The bar next door lets you use the restroom facilities while you wait. Then you stand in a small room and watch a group play jazz. It was a cool experience.

Warning: You will have to stand 45 minutes for waiting on line + 45 minute show. You can pay extra to sit, but I do believe you have to reserve that before hand.","2016-03-21 00:33:50"
"JRSF1NRI59s-CoJuZD_XDQ","K47RXWydxGWGQOJfFViPaA","PY9GRfzr4nTZeINf346QOw",5,0,0,0,"Peppermill Casino is one of my local favorites. I have been in Reno for about 18 years now, and Peppermill has always been a great spot. Between late-night trips to the café and good times at there club Edge I'm a big fan of this place. Oh, yeah and if you want some good sushi head into Oceano.","2018-04-05 00:00:55"
"nxUhvJm59UXw1EHBLCvKUg","FK2yenCV_2tFfzB-GA-6DA","aJvxWyQIG5OLfBw3qAe8xA",1,0,0,0,"Horrible customer service. Major attitude problem. Been to many Starbucks in US and in other countries definitely do not follow the Starbucks great customer service model.","2016-10-13 23:29:30"
"fkky_DD4zkx8MJSe8a29Kg","bEwAO2bA0eXABMiMIWXA2w","kGl2zBnLWTUBQLFkd0u_FQ",1,0,0,0,"Horrible customer service!!!! Extremely Unprofessional & disrespectful!!!!!  Will NEVER eat at this location again!!","2015-06-11 01:11:48"
"tmDjQ7rN3vnHzdX9E7KFQw","J9XiH5ZJUNucQMwOmGhEQw","ypXuDmnnPxnfP8a0qLsiEg",3,0,0,0,"The veggie burgers are just morning stars, and the fry portions are very small. For a vegetarian this is not a good option.","2014-07-15 19:34:13"
"qpNyyolexyyuP_orbN9Uhw","DDLaB6xkrotC9N15rGACzg","JvawJ9bSr22xn4R9oLvl_w",4,1,0,0,"The biggest oysters I have ever seen.  The rule that big oysters don't have the best flavor do not apply to the oysters here.  Sit at the Oyster Bar and watch years of shucking experience in action.  
Must haves are the barbecued shrimp.  The sauce is not a traditional barbecue sauce.. more of a heavenly mix of spices and flavors.  The bread pudding could easily be one of the best in the city.  It's made with a lovely whiskey sauce and the pudding isn't too mushy.","2013-04-16 22:27:08"
"THjUeoIJ0-8KiKUN-em_tg","T0Gud372HlTKw3poPRDmqQ","ZyNmWY66F9SD1JaPE9UzBQ",5,0,0,0,"the service tech was knowledgeable and had the parts on her truck.  I really appreciate her calling when she was leaving her previous appointment and telling me exactly what time she arrived.  She called our home warranty provider and tried to get them to cover our repair.  She really went beyond the call","2016-06-12 18:57:53"
"QBuzXeFaniMN3bvFxp6F1Q","t-KkmoyCk3-oBKP2QvNHGw","COclRBaXBjYpomS4syUmvg",4,0,0,0,"Monon Coffee Company is an artie coffee shop in the hip Broad Ripple area of Indy. They have some relaxing chairs/couches, free wifi, and great coffees and pastries. Although it is a bit small, there seems to be always place, as most people either stay only shortly or take away their coffee. Great to work, read, or simply get a good cup of coffee!","2009-08-23 21:17:38"
"LzZOtkRAvtNN2ATEAIfosg","gJoysYPgqG_zSUq9Y51W1Q","U6e8OQ-YEUOqMyrym3jhOw",5,2,0,0,"Awesome place!!! Great atmosphere, very good prices, quality barbers! Highly recommend this barbershop!","2018-05-19 20:34:17"
"Fa3BWh4xsAdYavUZc1A1RA","fGgRTgm7aaXI6pnBG7Z48w","uO39--k_hrCFgZh-Bl8m8A",5,0,0,0,"We got a selection of asada, carnitas, shrimp, and al pastor tacos and they were pretty amazing. They also carry taramind jarritos which is hard to find. Love this little find right off the fwy","2015-06-22 19:00:04"
"e1hKmbNKvLSiEI37x17g6w","CRhM7BR4NbR2ddriQzv8ww","7YiLEuHuUONZrMPT0OxXUQ",1,0,0,0,"The worst! Filled with homeless people. So, they treat everyone like homeless. Very rude service! Even if you're a paying customer.","2018-08-28 14:40:18"
"8g6W4NLufwaCU1fnWKLhnA","0jkLS0JLIqeGDXleUw-cDQ","pP1V9AvK716BMxoHkNVWdw",3,2,0,0,"You know, I keep giving these guys a chance in hopes that they will improve. They have not.

I had to clear my throat loudly to entice someone to come from the back to actually help me.

I was in on a Sunday afternoon and while they weren't busy there were hardly any cupcakes to purchase. I was surprised by the lack of variety despite being there with over 3 hours of business hours left until closing. The two cupcakes I purchased were lemon (for the wife), and a chocolate caramel pretzel combo of some sort. Once I paid for them I was anxious to eat mine. 

I got them home and once we had lunch it was time for dessert. My wife tried hers, one bite was all she took to be done. She said it the icing was too sweet and the cake too dry. I felt the same about my mine. Also, the caramel part in the description was not at all present in my cupcake. It really amounted to overly granulated sugary icing with crushed up pretzel bits on top. The frosting had crusted over so it clearly wasn't fresh. The cake was also dry so it too wasn't fresh. You are a cupcake place, that only makes cupcakes but you can't do that well? Clearly, this just doesn't compute.

Next time, I will save myself from these dry cupcakes and make my own.","2015-03-04 22:24:15"
"mfchMlnX2DbgS6PMzWp_nQ","mz6ZgGguuNubCJOKt5rp3w","TghRoAMx43V-9l7mH-SENg",5,1,0,0,"First time eating at Crabby Bills...we had the BBQ wings for an appetizer and the meat was tender, sauce was tangy.  For our entree we had the Lobster sandwich and Sea Scallops.  Overall the food was juicy and delicious...service was good in spite of it being packed - our server Kelly was very pleasant and attentive...will definitely return in the future..","2012-03-03 00:17:03"
"0V7B8LTZKQt615DSenon9Q","ylCjT5RkYDdDi4WdifgBww","voVM5CWSffrRCKNrjYBbvw",5,0,0,0,"I called to inquire about my chipped automobile  window..Sandy was friendly and efficient..within an hour Shawn came to my house and my window was fixed..lifetime guarantee. .courteous and informative. .highly recommend Shawn and this company!!","2018-05-19 23:47:52"
"156_4LYOPE5L-i-kRCLcsQ","6O91E5QSz5WMS8yJ0oyRpg","l_EQPW5NIIfi9s8rQfSufg",5,1,0,0,"Last Saturday morning I woke up to my Great Dane eating my glasses for breakfast. I had planned to visit the ophthalmologist during the week to get a new pair but really did not have the time to take off work. After being driven to the mall by a family member for an unrelated errand (could not find my contacts), I stumbled upon SEE and was delighted to find that they could give me an eye exam in store right away. The eye exam was easy peasy and felt like I had gone to my regular ophthalmologist.  Jennifer was so helpful in helping me select glasses that went well with my face (I always struggle with this). She also found a special deal for me to allow me to be able to afford a 2nd pair for backup in case of any future dog incidents, lol. All around it was a pleasant experience that allowed me to save money and get my new glasses ordered over the weekend! I could not be more please and will definitely return. Thanks again, Jennifer!","2014-12-05 12:54:29"
"7nJa0jm7Af9kr_BJSEgt_Q","-THLGnsYKu3yQAsy_tt1fw","MpkCQTOV6D3XGRPbtQPj5Q",3,2,0,0,"The owner (? white guy behind counter) was really nice. The bubble tea, however, was not. The bubbles were undercooked and flavorless. He did not ask if I wanted mine blended or over ice and I just assumed it would be over ice. It was not. It was poorly crushed ice (think chunks big enough to clog the massive straw mixed with pellets from an artificial snow machine) blenderized with grainy sugar, over hard tapioca balls. I had a huge craving for bubble tea and this place left me feeling unfulfilled. I do NOT recommend it for bubble tea, but based on the cleanliness, kind owner, and happy expressions of all the people eating there, I will be back to try the food. The tea was almost $5, so I felt it was overpriced too.","2013-01-31 19:33:49"
"WOkjWsurffpJRXyWXfDdNg","_-hsyfuQT9w0e3-ztdwTUA","0ICfbEImE0gUZc4kSZ7QHg",5,5,0,1,"What an impressive company! We recently had to replace an old furnace and water heater for my mother. We were totally blown away by the professionalism and the customer service which we received from every point of contact. The helpful people on the phone, Dave, the sales person and the people that came to install the furnace where all wonderful. They turned what could have been a very stressful situation for a senior into something pleasant. When the furnace was installed, we were very impressed with the workmanship  by Nick and Ron. Everything looked like care was taken, it wasn't just slapped together. They were efficient and left the basement clean, we were so impressed! Perhaps the nicest thing was the peace of mind they left my mother with. She now feels comfortable and warm and knows her  furnace is a good one and she doesn't have to worry about it breaking down in mid winter. Thankyou everyone at The Furnace Company!","2012-01-10 18:43:28"
"GQjlp7Trr8F6GwGqlTqIdg","jlwDCJ5lvmScaT0N4TLqCw","kKPJLiHIr9Gd9sYs3GhxDQ",4,0,0,0,"Great date night spot. Will be coming back again! Thoughtful, unique dishes + attentive service.

Food:
- hand cut truffle parmesan fries: would've preferred it to be a bit more crispy.
- carpaccio of beef tenderloin with house made ravioli: our favorite dish of the meal. fresh carpaccio and the house ravioli stuffed with soft poached egg was a nice touch. 
- roasted mushroom flatbread: second favorite dish. a lot of mushroom and arugula. would definitely order again.
- pulled slow braised short rib fat noodles: creative dish; loved the braised short rib with fresh pasta combo. but a tad too sweet and too salty for my taste.

Can't wait to come back and try all the other dishes!","2017-10-03 13:36:38"
"LyyI136UWgEdrFB8KG-gfA","RpI9a_pglhOqpPB0NF2BYA","UCMSWPqzXjd7QHq7v8PJjQ",5,0,0,1,"Excellent breakfast/brunch spot in Tucson. Menu consists of various pastries (croissants, Danishes, scones, etc.), pancakes, egg dishes, etc as well as an extensive drink list (specialty mimosas, teas, coffees). This morning I ordered the fruit granola parfait which consisted of a large serving of organic vanilla yogurt smothered in fruits (blackberries, apples, strawberries, raisins, cranberries) and nuts (pine nuts, almonds). I ordered a side of walnut bread which came with fresh whipped butter and fresh jam on the side. It was delicious. My sister ordered two eggs with homefries and toast which she enjoyed and finished the whole plate. Perhaps the best part of the meal was the freshly squeezed orange juice- the freshest and tastiest I have ever had. Coffees and waters were continually refreshed. They really aced it.","2015-02-24 21:37:58"
"8GZbCEMxrbqmRinDbfHWVQ","OkjeFppodgJP_CvB84cJYw","FHNIvNgh3fS7VZQq2Y3dsA",3,1,0,1,"After trying a few ramen places with crazy variety in their selections and stellar broth, I was not too excited about the ramen I got at Cheu.  Maybe it's a matter of taste, but personally, I was not a fan of their thick noodles, and extremely salty broth.  

The service was great, and they had a nice selection of beers!  The friend I went with loved it, and has been many times.  Honestly, I'm just sorry I wasn't a bigger fan.  But I hope others try it for themselves.  I might just be an oddball out on this one.","2014-07-13 18:28:58"
"W6cl0P3LaYjWU5a26vaTyg","NmWq8MYyckcaiSJS9nG8wg","jGewGnIYcf9LFBcR8lMC5g",2,1,0,0,"First time my wife and I dined there. It was last Thursday night. The place was half full. Nice environment - we sat in the back room where it was quiet. 

I had the broccoli soup and had to send it back. It was not enough broccoli and too much chicken broth. My wife unselfishly share her salad with me - don't know what it was but it was very good. I had the linguine and my wife the salmon. The linguine was fairly greasy and not very tasty. I ate 25% and took the rest home; I didn't eat eat later. The salmon was good. I guess I was having bad luck! The creme brulee was nice. I noticed that I was charged for french fries the waiter forgot to serve us, it was taken off.

All in all a fair but not good dining experience. 2 glasses of wine, appetizer, entree, desert and 2 coffees came to around $80 without a tip. Limited menu. I'll go somewhere else next time.

I gave it 2 stars but it should be 2 1/2 stars.","2011-02-21 23:05:02"
"7i2M6HU0bOxukQLYg8otJQ","YlIH4MEz-loU8SDtepQSuQ","tP8wd-9CrI_RkHK424oifQ",2,1,0,0,"I love Panera and I eat there regularly in Texas. But this was the worst experience I've ever had at any Panera. Took over 25 minutes to get two orders of oatmeal. After 20 minutes we went to ask what the status was and the employees laughed as they told us they forgot we were here and had ordered anything.","2016-02-01 17:12:16"
"WWP0Fy48DnMGwEjpLmzajA","ZKI0DZTiscVjSFGFQNix7g","bguzzvkFJ2gPGvtvXwfPCQ",5,2,1,0,"Since I moved to Philly a few years ago, I have been on the search for a yoga studio that feels like another ""home"" to me. I found it at Yoga Garden on South St. The owner, Mark, has taught many of the classes I have taken so far. He embodies what I feel yoga is all about: being centered, compassion, and emphasizing balance. In his classes, he is ""hands on"" (with permission) on guides everyone through energetic sequences that invigorate the body and spirit.

The studio is always clean the ambiance is calming. Classes I have been to have never been so packed that I feel uncomfortable (like a canned sardine). The manager & receptionists are welcoming and polite. I have taken both ""all levels"" and ""intermediate"" classes, and I always get the level of challenge I'm seeking there. What more can I ask for? I found my new Yoga Home. Namaste!","2013-09-07 17:17:38"
"2vrnm1nqC-0ylz4auzWZ7g","klaZ8hamyYIwHe_tYIssHA","JcP1z6eZBgTIcxWlyxSw0g",3,0,0,0,"I wanted to love it so bad, but it fell short of my expectations.
PROS:
Bread presentation was amazing
Pork loin was so yummy. All the flavors on the plate complemented each other very well and you're filled without being stuffed
Drinks were phenomenal.
Desserts were a perfect portion and, although not unforgettable,  were a nice end to the meal. 

CONS: Service was not what I expected for the restaurant. It wasn't bad service,  but it wasn't outstanding either. Though I never felt rushed, I did feel intimidated by the waitress and she was very to thr point. It threw me off. I asked about different drinks and got short, brisk answers. 
The steak frittes: steak was chewy, in a full of fat and nerves way and seasoned poorly.","2014-04-20 14:52:30"
"OAhBYw8IQ6wlfw1owXWRWw","1C2lxzUo1Hyye4RFIXly3g","BVndHaLihEYbr76Z0CMEGw",5,0,0,0,"Great place for breakfast! I had the waffle, which was fluffy and perfect, and home fries which were nice and smashed and crunchy. Friendly waitstaff. Will definitely be back!","2014-10-11 16:22:06"
"IuIp5xVmIF1ek-356nJVfw","10Sfh5kLLVeckl2U1f8VkQ","2er_V-oAd7IbQ5YTY56r7A",4,0,0,0,"Was quite impressed with this little place. Unique and yet charming. The food was delicious! Grass-fed meats and great choice of fabulous cheeses!!! We really enjoyed....definitely try the fries!!!","2016-12-22 03:14:54"
"N7marL9QvLgKxC1vXVH4TQ","rqz7WV6rAgKk2dlQFdssJw","mBeSTUmigL9HGcfAjGRTQQ",5,0,0,0,"I have a finicky dog and One Lucky Dog has the only treats my little girl will eat.   The staff are always so warm, friendly, and helpful.    I especially love Heather who grooms Rosie.  She comes back to me so soft, clean, and beautiful.  And the prices, I feel are very reasonably.","2018-05-12 12:56:22"
"Av7NldOjGRZzB5ftpN4r9A","Do0t-Yq4bmOKGAnQzvc2wQ","tBT4yR-8dRwH89nzjpOzOw",5,1,0,0,"Voree did a great job repairing a laptop for me - fast, reasonable, and effective service.  I used them again for two other laptops.  Don't ask me why I keep having trouble with my laptops.  On one of them my granddaughter broke the display screen and Voree fixed it quickly.","2013-09-11 14:16:33"
"X7WtTI_eis5sUE3lBrnmwg","WjsZSsBbUTwkGUIkv7TpjQ","KAk07Tbv0UsoY-s7RYfepg",4,0,0,0,"It wont blow u away but it's a decent lunch spot. U wont have anything undercooked. The sesame bread is pretty good. I recommend sticking with egg drop soup unless you are used to the flavors of the other two. Option between white and brown rice, i feel like they missed out on the opportunity to have fried rice as an option. Overall i enjoyed it.","2018-05-29 20:17:03"
"HxVRch8wYZ2IvNMDxtsv2A","h3lF7gq22wCL_-14UNo8Wg","ywL2oIACV9FVEPRW66wCZQ",1,1,0,0,"ADT installed a faulty transformer, which was discovered when our entire system went down.  A tech wasn't available for over a week, leaving us with no fire, co2 and alarm protection.  We were finally told that someone would be available the next day if we wanted to pay OT - a minimum of $400.  They offered to reimburse us for 3 months of service - less than half the cost.  We asked what constituted an emergency to get someone out at no charge and were told the transformer blowing up and starting a fire.  No logic worked.  If we didn't have a contract we would cancel our service immediately.  Unfortunately we are stuck.","2014-06-14 02:08:40"
"TIXJwpXHfijzySSo7qlhDA","Uz1CdLc3wTwgWmHeGnAFpg","ComvlRfBVFHLQRM57hhHyg",5,0,0,0,"Sharen's took my order for delivery and a beautiful arrangement was delivered within an hour and a half.  
Great customer service and beautiful flowers!!!
Thanks again Sharen's for making my friends day.  :)","2018-03-16 16:24:24"
"Zv4Yw_UsHtKJyvm8ggwXjw","hDNgxRU92aaPizSVi4Sm9A","wFES5bGDiPANW13hNHnXOQ",5,8,5,5,"Literally the best sushi known to mankind. 
The Yellowtail Melt is a veritable cornucopia of flavor that will undoubtedly give you a mouthgasm. 
Try out the Champagne Fluke for a tender, rich taste that will make your eyes roll back.
The merry-go-round will feel like tiny mystical creatures dancing a magical jig on your taste buds.
And always end the night with another yellowtail melt, it's just the morally right thing to do.

You won't be sorry.

P.S. Legend has it that every bite of Nao's Sushi will add an extra hour to your life.

I hope that is true... I go here so much, I'm probably just about immortal.","2013-10-28 20:54:34"
"NihbZscybSZCTq5u4hE9IA","jOND-BIBmG7yOzJshELbiQ","q542fY8AV1VjiP7A7z6S_A",4,0,0,0,"The woman behind the counter was very helpful and friendly. I was looking for a saw and she showed me their bargain bin saw as well as a sturdier if pricer option. They have all the basic DIY stuff for home and garden. I will definitely shop here before I head to one of the big box stores!","2014-10-29 01:03:54"
"0balaMRhJHMk3uiDXcuHng","slLS-F4ReHk45QCCURK6xg","dz_aIFbATP2PLWQSOBnMfw",1,2,0,0,"Not sure what all the hype is about. We came in at 8 am got seated right away. My husband and I ordered a pretty simple breakfast. 2 eggs bacon for me sausage for him, and fried potatoes and toast.  I did ask for fried onion in my potatoes. A 50 cent up charge for a scantily amount of fried onion thrown on cold potatoes that tasted as though they were fried the day before. My eggs were ordered over easy, one was and one was hard. My bacon was cold and burnt.  My husband's sausage was spicy, I like spicy, but was too spicy for my breakfast. Toast was cold and dry. You have to butter your own at the table, so hope it arrives promptly. Our bill was $18 and some change. You decide. I will go elsewhere for my money.","2016-03-31 13:02:44"
"hyTNd5dbaZaySU_15r1smw","c_Jpjy4O1bVB3P1ru5G7Bw","i5gYq_x-Xdf83HmwFX1k4g",3,3,2,3,"Antiques everywhere!

I've seen some pretty unique items here. There's a little something for everyone, and the prices are decent. I wouldn't advise bringing young children inside, though. This is a very small store, and even an adult like myself gets nervous about the chance of knocking something off of a shelf.

If you can keep your hands, and randomly flailing accessories, to yourself (that  heavy purse can turn into a wrecking ball real quick) then this is a neat place to visit.","2014-02-26 21:13:35"
"nRllITZPHgpQujxHhSNgag","xv6tLH4OETwDx4B_BiNWbA","z680Aylt8wN2KAeFM1hy-A",5,0,0,1,"Garlic and cheese chips. That's it. I crave and rave about these things all the time. Goes great with my St. George's Philly.  It's a wonderful pub feel, very chill, non-pretentious, great price and----as previously mentioned----I love the food. If I still lived downtown I'd go more often but when I'm in the area I make a point to stop. If you're a fan of English brews, they have some interesting ones (and specials). Sit outside and enjoy.","2015-08-12 19:44:34"
