"review_id","user_id","business_id","stars","useful","funny","cool","text","date"
"F4iNyrFWplGF6qaVJSiosw","VXi55bSeRJEmK51zLq3ZaQ","jmwasbZfgj3honf79qKsnA",5,0,1,0,"I'm completely addicted. I am from Texas and know a good taco when I see it... These are incredible, best tacos in Tucson for sure and the best tacos I have had in all of Arizona. I love it because the meat is not fatty and is seasoned just right. The margaritas are wonderful too, not too sweet with the perfect amount of tequila.","2016-10-04 07:21:25"
"-twT4h6VcPtUdchZ1EH3og","gvwUj0-PbEJ37IZcN_6EAw","9MHe5jAym2d8VhT_NbCRyw",1,0,0,0,"They do not care about customers.  My online order said chow mein, but I wanted lo mein.  They wouldnt budge and I had to pay for 2 orders even though I did not accept the chow mein.  Will not be returning.","2015-10-17 17:53:07"
"7usCdGCOg27T5GKBc3pSaA","OFMVLbC_87dyePhfHMHqfA","X5fWO9e82EICHXzzs6eQMg",4,1,0,0,"I've had a facial with Linda and it was definitely 5 stars. It was my first one ever and she was absolutely fabulous at relaxing me and I left with skin like butter. I ended up buying cleanser, moisturizer, and p50. They've been pretty decent products but smell a little mediciney and were super expensive. I've been back to buy refills on everything but the moisturizer- that one is a little too stinky for my tastes.

The only thing that brings this review down is the eyelash tinting I got there once. It took place in the middle of the salon and was very stressful. You have to sit with you eyes closed for 15 minutes which is pretty hard to do when you're sitting with so much going on around you. Also, it was really burny but I'm not sure if that's normal or not.

I would definitely return for the facial but I'm going to pass on getting my eyelashes tinted there again.","2012-09-11 19:27:28"
"2P4b4YOTTmFgop54hwK4qw","caoF0_Kjsrkder16ytYNEg","yuW60QyweNNcyHa_3fkrYA",4,2,1,1,"Absolutely LOVEEEE diners and Jewish deli's and this is a jew diner. 

Highly recommend the pastrami sandwiches. They put a lot of twists on them, I got it over Latkes and the latkes were perfectly crispy. This place is decently priced.

I would give it a 5 star except that the decor was still like the old ownerships, except for the Easter themed counter. And that it doesn't include a free salad bar or dessert.","2018-04-06 01:37:37"
"mJ8_yEPTN4meiOyugh2ILA","Tmp2Jr5eFD31hwkXpn_U5g","YJUzSi__NEAVZuEIdPZL7Q",5,1,0,0,"Great company with great customer service and a product that actually works. Used to have true green and decided to switch due to horrible customer service, not to mention they accidentally killed some of my lawn. Go green has been a pleasure to work with and my lawn looks great. Satisfied to say the least.","2018-05-30 23:01:48"
"ocF1EDw3DCK8mGRD9kDqtg","c-zhpahO2REouIdWpihxDQ","C1D2o1VV2TDjpkG3BsdseA",5,0,0,0,"Came here with friends who were in town from Texas. The service was great. They let us in the side door bc it was freezing. They put tables together (9 of us) while we ordered. Everyone was so nice. We ordered a variety of food and it was all tasty. My wife and I have been coming here for a long time. Recommended for sure. Even my daughter says ""It is so yummy!""","2016-12-19 20:06:04"
"uiTD8HyV_y0cicGJW9Njcw","ayT5ikHh47C04P1klWaB8g","T-uphPk44OFt6sR8F-0uHA",4,0,0,0,"In town to visit friends and they brought me here. Cool place and the beer selection was fantastic. 

I tried the beer sampler and it delivered! They just released their seasonal Winter Warmer so I had to try it. It was delicious! Ended up ordering a pint :)

They must be known for the burgers because 3 of the 4 of us ordered them. They looked amazing! Huge, juicy and fresh. I ordered the PEI mussels because it's something I don't normally see on a menu in Syracuse. They were amazing. The ""small"" order was huge! The broth was creamy and garlicky and perfect for soaking up with the little loaf of toasted bread that came with it. 

We also had the cold  Dan Dan noodles because they sounded so good. Yum! Spicy, sweet, crunchy perfect little side snack.

Would definitely come back next time I come to town!","2015-11-07 14:24:24"
"qK9TAJRASui6fmICYRL4lg","2wpL9OKoR_BIsUrohMlxNg","ULnW6ynhmbU2tOOIKtgWww",4,1,0,0,"Pretty novel, definitely a change of pace from your typical night out of chills and thrills.
$26/person for the paintball zombie shoot a/o this date.
Line was pretty stiff, something like 2 hrs which flew at least given the company (4 of us 30-somethings), but it's a fair barometer of the draw for this attraction.  Ride itself was a bit shorter than I'd like/expected, but you can see they put considerable effort into this venue.

Something like 20 semi-auto paintball guns to each side of the trucks, guessing about 2 trucks total, so the turnover was high, but again, the lines.  There was ample vending and so forth, but I recommend you bring a hot drink.  You may need it.","2015-10-25 04:43:44"
"zPOSXgcAObiG4-29K1fQOw","M54hUU_dlq3ehat90ZqR1w","rG0UTjvbmVVsh9-kGzeliQ",5,0,0,0,"Cam honestly say I have never had a bad meal at this establishment. I have tried their soups, salads and sandwiches and the ingredients are always fresh and tasty. My personal favorite is the roast beef sandwich.","2018-07-10 01:01:40"
"oM_uV6q6JOXJh6bIX9rx2g","oAhoFRRKomodbIx8jtKmKA","UADDyUMFvV-KjFBNav7tIw",3,1,1,1,"Not much to say about Paddywagon, just your run of the mill bar. Options are limited downtown but this is a solid place to grab a drink in the area. If anything it's worth starting here before migrating to The Hub around the corner. :)

They have a decent beer selection and friendly staff. Always a lot of sporting events on plus bar trivia (it's super easy, too - so you can feel smart even when you're drunk!). Plus plenty of bar games to choose from.","2015-01-21 20:28:40"
"-vJKKvrY-RLtZgRUYuHocg","2kOk9ZjN5NlL38t2djNM6Q","M0r9lUn2gLFYgIwIfG8-bQ",5,0,0,0,"This place really is as good as it gets, burgers are fabulous and come in interesting combinations, the fries and house chips are perfect pairings to any burger, and the handmade ice cream is stellar.","2016-04-01 14:04:35"
"eVnsjDiQ4NfTKUWSMWayrA","p1GCsCl92d3VBtDFA-KB4Q","M2ZrrqseHE5xssUrOL0Gtg",5,0,0,0,"Great local diner. Had the corned beef hash and eggs. Made perfectly with fast, friendly service. Will be hitting this place often. Open 24 hrs.","2018-04-16 14:38:03"
"SiWUJHcUXsnrwCWKR3rAKQ","vWJwyktdtPziFVGtr-CFkw","xCXGV3wEvYd4xBGx8ZRFQA",3,1,0,1,"I like this place--it's growing on me.  Beautiful decor, sort of antique-ish.  They serve a wide variety of foods, including breakfast (most of the day) and sandwiches and quiches.  The tomato basil soup was great, and so is the lemonade (I'm pretty sure it's free of corn syrup!)  They have free internet if you purchase something, but are strict about ""no internet"" during the day on weekends, and can be kind of touchy about seating.  

The customers are a mix of locals, students, and a couple of ""grown-ups.""  They prefer cash; you must spend $10 to use a debit/credit card.  They're only open till 9pm, though, which is why I often choose the Good Karma instead, since they're open until 10pm.","2008-12-12 01:38:13"
"lwi3xs7qBFxBl6Qi0Ki_6w","ZPe3RxyjNEG_QTjjgYECkg","tiVQ9_qoatNn--ITbMWRpA",4,0,0,0,"Out of only a few bagel shops in lower Bucks County, RJ's is the best. I've been going there mornings about once/week for the past year and I've yet to be disappointed. The coffee is always piping hot and sometimes they even have flavored decaf. There's a great selection of freshly-made, good-size bagels. They smear on a generous amount of cream cheese. The counter girls greet many customers personally and always give me speedy service. One of them handed me with a coupon booklet while waiting for my order, which was very thoughtful of her. A toasted bagel with cream cheese and a small coffee will run you around $3.00, cheaper and better than anywhere else nearby. The $.99 breakfast sandwich coupon can't be beat.

The only reason I didn't give them 5 stars is because the fryer boy was only wearing one glove while preparing my egg and cheese. I've never been there for lunch, either.","2013-10-04 23:42:39"
"tiQhDzuNDvdn9vEvG56lDQ","z1QAVbVgdEnMNmAZ0yQOkg","geUiM_VTRmUz6dViO7E-jg",5,0,0,0,"Just found my new favorite place for pizza, didn't get any of the pizzas listed on the menu, built our own. Pepperoni, sliced red onions, roasted garlic. Was perfect, not too much cheese, the right amount of pepperoni, onions weren't over powering, and the garlic...oh yes, not your run of the mill minced garlic, but cloves of roasted garlic. All their pizzas are 10"", perfect amount for two, didn't try any of the appetizers, but I'm going to do their survey, and get one for free. Looking forward on going back....real soon.","2017-09-09 00:51:10"
"B0TNL8-R7qTtwPCsYT4Wiw","DDJliZbj8VYfwikMQWbrBA","7lwe7n-Yc-V9E_HfLAeylg",4,0,0,0,"The hubs and I stopped by Pub & Kitchen for the first time last Saturday, and enjoyed a lovely evening.  The ambience is great - we sat at the bar and loved the look of it.  It was dark enough to have some good ambiance, but light enough that I could see the menu.  We only had drinks, but they have a nice selection of beers on tap and other adult beverages.

The food seems... interesting?  A little fussy for my taste, and certainly pricey ($18 for a burger!), so I'm not sure we'll go there to eat.  We did, however, smell the french fries that the couple next to us ordered, and they smelled divine.

Great neighborhood place for a drink.","2011-04-26 20:54:03"
"PcQdksxp4hx8xETWASO2Zw","rP4heXQJrOeTIW3_EWqokQ","14ZGwnDyydXdSBsLXpSUrA",5,0,0,0,"This is one of my favorite Thai places in philly! I love their Pad Kee Mao, it was perfectly flavored and left me wanting more. 

The only thing is that it's not the cheapest dinner option, but the price is worth it. I am looking forward to trying everything else on the menu.","2017-08-11 18:09:40"
"1qEu-oSSqjhZnZR2bwi2mg","NGPfFZL7VfN-R0vjUHLauw","5cpiSREZioyiHVHXJ9WRqA",4,0,0,0,"My rating is focused on the whole package.  

The price: is superior, excellent and very low.  Where else can you get sushi that will fill you for $6.  
The restaurant:  Small, little room.
The environment:  fun / unique.  Sam is a one man show.  Read the rules here from other users.  He is part of why I come here.  I came there once ordered two rolls, and an order of edamame.  He said that it was too much food, and that he wouldn't make the edamame.  He was right by the way, couldn't even eat both rolls (for $6)!

I felt bad since the price was so low and wanted to give him a nice tip.  He refused.  I did place the extra change in his change bucket.  

I continue to go back to Sams as I do like this restaurant.","2014-03-21 21:01:32"
"rbtEo5MW6sW92sSBPnmKJQ","sxsHfVBO43iiyYUaVZstuw","VN2CJfXX6ooJt-Nc3vKt9g",3,0,0,0,"This place is HUGE. There are so many options and things to look at! I was here for at least an hour and a half and I didn't even check out the items in locked glass. If you're looking to decorate this is a nice place to check out. However there is a lot to sift through and since they have something to appeal to everyone it will take patience to find something you're looking for. There were a decent amount of things I would consider un-worthy of an antic store but that's a personal opinion. To balance that though there were also some great finds. My biggest problem with this place is that a decent amount of stuff seemed to not really be vintage. Maybe 1980's vintage but some items were new and some only a few decades old. Again, it depends  on what you're looking for. There are definitely a lot of trinkets here if you're into that. The prices did seem a little high but I've not been to a lot of antique stores to compare it to!","2017-04-09 02:11:02"
"-5dADzbhRhGRxSxN3c_HbA","5SBWWScaC4QNql6XkHJPmw","I6L0Zxi5Ww0zEWSAVgngeQ",5,0,0,0,"I read that Cafe Beignet was better than Cafe du Monde on a travel blog so I had to see for myself.  On my first day in NOLA, my first bite was at Cafe du Monde and their beignets (although looked like funnel cake) were damn tasty.  But when my friends and I visited Cafe Beignet on Bourbon Street, we all agreed that these were lighter and thus tasted better than Cafe du Monde's.  The disparity is probably negligible but it's also nice that Cafe Beignet has live jazz music playing while you scarf down the fried pastries.","2013-08-05 22:38:07"
"UTInIiR0dT4CyfnzAhoQcA","CIyOsZ54LKDKg485ooESYQ","F8yozE3NWnImNApHO347gQ",5,1,0,1,"Love this place. My favorite is their eggplant. Will definately go back again..great place to go with a group. You will need a reservation.","2015-04-29 00:14:05"
"_Im8qcIEdyAUGnWEEdtO5w","NSg8AzcqVpiQnd25tePsDA","mcr1lAEdvGLMJhuPwI3I2A",5,1,0,1,"101 was delightful! Stopped by after working up an appetite running errands in town and we happened to show up during happy hour - two for one drinks (possibly also applies to alcoholic drinks, but we both got boba teas instead)

The scallion pancakes were a perfect appetizer. They came out hot, crispy, and a little oily, delicious.

The tonkatsu chicken and fried tofu bao were both delicious. All the condiments on their bao make for a sort of savory, sort of sweet flavor combo (cilantro, sweet sauce, and a few other things I don't remember off the top of my head)

The popcorn chicken was also excellent. Tiny, very crispy bits of chicken served with rice and a potato salad. I didn't try the potato salad, but heard it was more of a macaroni salad. 

I highly recommend Taiwan 101. Food is cooked quickly, staff are nice, and everything I've tried so far is absolutely delicious.","2017-10-02 19:12:04"
"adBJVy8NVXPEncbdfoQU_A","PA9S4FqAZ4Ub3_d7Sw7kow","cXSyVvOr9YRN9diDkaWs0Q",1,2,1,1,"I was very dissatisfied with this place. I've been wanting to eat here for a long time but every time I tried, there was a line out the door. I thought to myself, ""wow it must be awesome!"" So I decided to grin and bear the wait to finally experience what I thought was gonna be awesome. The breakfast was extremely expensive for mediocre taste. I had a simple breakfast of 2 eggs, home fries, turkey sausage and 3 pancakes and I asked for a side of toast (the honey's platter) What I received was the smallest pancakes I've ever seen, 2 eggs, one small sausage, a bite of potatoes and my side of toast was one slice not even toasted. This platter cost me $13 THIRTEEN DOLLARS!?!? The taste was sub par I couldn't finish the sausage bc it was gross, the potatoes were greasy, the eggs were cooked well and so were the pancakes but 13 dollars for a standard breakfast is insane. My one slice of untoasted bread was another $2.50!!!! Don't get me wrong I'm all for spending a decent amount of money on a good meal but this was hardly that. My dining partner got the Christo which is essentially a ham and cheese sandwich and a small amount of greens on the side, which she enjoyed but was $14. All in all the check came to $42 after drinks and tip. I would never return to this place, I left feeling dissatisfied and let down and created a yelp account just to write this review. The only thing good about this place was the company and the service was on point (but I guess it should be when you're charging that much for breakfast items)  If you want a good meal that's worth your $ with top notch food this isn't the place and you should try Silk City!","2013-07-13 16:59:07"
"LC8yrFF9uQWBuxALub7bdQ","d5rUVUIgj6OkLdIZpH2I1w","Z5ochgsEdh8O82g3lUfk0A",5,0,0,0,"Great food! The chicken kebab plate was made to order and really tasty! I love places like this! Family operated and owned!! Will be back soon!!!","2018-06-19 19:15:36"
"wxRDzcQVbLlgktyWKNmYtw","RT4yCpSnV-J3KIMYSfV6BA","IwqFmo-RJs15WvA8PVHFnA",5,0,0,0,"Moving from Austin, one thing I thought Boise was missing was good tacos.  Wrong. Great tacos, awesome beer and even better humans working there! We will definitely be back!","2018-09-15 03:12:22"
"HEwltoD3vfg58QDpi9VWnw","dem_Ak6wd0ybFO65nrFiXQ","-3AooxIkg38UyUdlz5oXdw",4,0,0,1,"Great little local restaurant. We sat on the front patio to catch the full moon rise last night. Unfortunately, it rose off the back of the restaurant. Christina, the hostess came to find us and let us know the moon was rising out the back. Friendly, helpful staff, & great food. This is the kind of place that's indicative of the friendly Santa Barbara locals. Also a good place to visit at Christmas. They always do beautiful decorations.","2015-02-05 01:25:42"
"8Y3Qnh74cQd2S-iTXjrLmA","I0ezkVvCcBnavJf2soWHjA","j8JOZvfeHEfUWq3gEz6ABQ",4,3,2,3,"Through the wine shop and out into the back yard, uncovers a secret garden; this one is with a hodgepodge of mismatched lawn furnishings and custom cheese plates paired with straight up delectable wines. How great is this place? (So great). Twinkly lights, live music, great wine, and fresh beautifully prepared dishes make Bacchanal a total hideaway. We were there on a cool night in October and it was a little piece of patio utopia. And we freakin relished it.","2012-12-13 00:16:59"
"RituzqUEogVGW8cMUhJ2lA","uIBhZTxEdOw1FRVpSJ45mQ","-x7YizC9UmmjMuSGxrw1LA",5,0,0,0,"We love Waffle House, all three of us ate for under $13 dollars. The food is always great and the waiters are always friendly.","2013-05-11 06:55:41"
"EkyngzdkHzMzL7Tumaw4FQ","or2JsmaC-mbyPNM7AJQwqQ","_JXfCdMu1TFblbhJ5KT7fw",1,0,0,0,"Kao soy was basically curry water soup with no flavor. I didn't get asked what spice level I wanted. Service was the absolute slowest I've ever received. No sense of urgency. They couldn't figure out how to split the check. Everyone working there was old and slow(no offense). But it was bad. Just horrible awful service with mediocre food. I'm done with this place for good. Don't waste your time. Go to king and I instead. They never disappoint.","2017-08-21 01:48:57"
"nYVGowsSH6UM6oIuZ1x1rw","HTxZnniYcqLlJiEB2yZEYA","ltBBYdNzkeKdCNPDAsxwAA",5,0,0,0,"My friend and I were visiting Nashville and found this place through a quick google search. We were staying downtown, so it was a quick and cheap cab ride away (5 minutes/$7 ride). We went on a Saturday night, so there was about an hour wait. We decided to grab a drink at the bar (no wait there) and stood around chatting/playing a charades game on our phone...which helped pass the time! The drinks were avg. $10/piece. Not cheap, but normal for this kind of restaurant. 

Once we were seated, we knew we wanted to try their french fries (we had previously scoped out the menu) and quickly ordered the sweet potato ones. She ordered the mahi sandwich and I went with the chicken tikka masala, Both were very good.

Would recommend and return!","2015-02-03 17:57:27"
"QxgyDnifTp1vNdBbBsZZqA","lj0K0BLs-PEJXzMHsH7I0A","6FvC6w810uf6O7Ocd6Wpog",2,0,0,0,"Foods good but, there is not seating and it's very loud. They ran out of ciabatta buns.","2017-06-18 18:10:08"
"IM3_NqjStBDwmQT8wLtocQ","0Igx-a1wAstiBDerGxXk2A","r7ENkA0Pyjs8NSFHVwnmOA",4,7,3,4,"I was on a mission of mercy and picked up dog food (not in my neighborhood) for a friend.  The staff was really nice and repeatedly offered to carry the bag of food to the car. The prices seemed compatible with big box chains, but this is a locally owned store.  (The original is in my childhood neighborhood). PLUS you get the convenience of down the street, well y'know if you're my friend.

Nice selection of doggie items, collars, treats, food, etc. I didn't look at cat stuff.","2013-05-08 16:47:28"
"po4V0b2LKD_WuQlvZuepng","2ooPpgOMq9GOHAfSEeJ9Nw","E-zz8gs1riWX0r3hxAn60A",5,3,0,0,"Valerie Biscardi is a gem. She's a straight shooter who is very personable and extremely knowledgeable. I suggested a handful of friends, family, and colleagues switch to Valerie from their previous optometrists, and each one has a heroic story about how Valerie's smarts provided a nuanced prescription or treatment or piece of advice that all of the prior professionals missed. And what I really love is that amidst all of this, she's also quite conservative when it comes to treatment, so you won't need to worry you're being pushed into something to satisfy her ego or a quota. The office is upbeat and you never have to wait for long. Worth the trip from the burbs, too, as nearby parking garages are plentiful.","2017-08-30 17:03:30"
"A81eEJN_9ICFqKQli8Vllw","oLvIjpLBSaJPuvgZ3BGDEg","eMiN8nm70jjKg8izikVWDA",4,0,0,1,"This place gets PACKED. 

Luckily, we stopped by while there was no Philadelphia sports team playing as this location is right by the sports complex. Chickie's crab fries were one of the first foods I was introduced to upon moving to Philly and it pretty much changed my life. 

The white cheese sauce? Fantastic! Sure, it may not look or feel like cheese, but it makes the fries melt in your mouth. 

Pete's Pizza wasn't as tasty as I had hoped. Clearly pizza is not one of their hot menu items. I would stick with the crab fries and cheesesteaks for a more authentic experience.","2011-05-29 17:54:11"
"3vNMZmDFSgmPgjSz_zXiOA","YKCRrpjUv3LroNC86g8ezg","d8tLbQ9o3aVdOLgueJtYXw",4,3,0,0,"I never venture to the northeast side of the city, but recently a friend and I found ourselves in the Old Town Beverly. We noticed Jay-Bee's and decided to come back for breakfast the following Saturday. We were pleasantly surprised. It has a sort of old school diner feel, and the decor is pretty nice. I was happy to see turkey bacon on the menu. I don't often find that. The service was good, the food was good, and the prices were fair. Can't wait to go back again.","2013-04-13 15:26:58"
"uyzGGmupA_yIEqT5jJBR-w","UJRpPvSeI3fJ7WH7mAPWXg","bRhnVTfuxDchyFguyDzuDQ",5,1,0,0,"This place gets how to do it. Online ordering, with tip included! They show up when they say they will. The food! Great sushi for a perfect price. Just love this place.","2015-06-22 00:18:31"
"3oTosvffErEsy2cMW458rg","fvrfj8JcRqePx5LrUrteyA","dPfxNIJeHLKpny0GKtAsXg",2,0,0,0,"Ordered take out from here. The person at the bar acted put out by us coming to pick up our order. The food was ok. It would probably be better to eat at the restaurant.","2014-01-18 23:56:59"
"rKB9EIGumsiUJu5KYebstQ","C6zbjvzWjBad_vBk5iWw6w","dGVsh3S39RlPj_MfBZklZQ",4,0,0,0,"We had our wedding at Elings and it was absolutely wonderful.  We had the ceremony in the ampitheater and the reception on the Godric's Grove deck.  We received so many compliments - everyone wanted to know how we found the place.  The park staff were very easy to work with throughout the process.  Our only complaint was that the outdoor lights didn't come on once it got dark so the bathrooms were pitch black for our guests.  Luckily we gave out flashlights as favors.  Even with dark bathrooms, we'd do it all again.","2014-06-13 20:43:38"
"tx6He9UCIWaSKUdXAVW4ZQ","eXn7l2sSDsPmaIMb9Bz2Fw","CWdCNIJU4Kh480NV9dgQjw",5,1,0,0,"This place has a northern California vibe. Reminds me of breweries in napa. Very open large space and a good selection of craft beer. The other side is a winery which is neat as well. 

I recommend trying their flight of beers to get a taste of everything.","2018-07-07 23:29:59"
"vwcKXXoyd9VSCQKLznWVfg","4Q8lRllC6fXuDFzUOsu9ag","JcP1z6eZBgTIcxWlyxSw0g",3,0,0,0,"First off, if you want to eat here. eat here while you can, it is closing the end of May 2014. A new place called Latitude 29 is opening up in it's place. 
Our group sampled each others fare and all arrived at pretty much the same conclusion, they have quite trying or their cooking staff may have left already. Way too pricey for the quality of the food here. The quantity is fine, it is the quality that was lacking.","2014-04-21 19:49:09"
"uTwjynhcU6Gv3DOr9C_GcQ","geLmtmUccuENzCFNP4Je5w","sr-5EY6bmp4jINhea06MjA",5,0,0,0,"This is the most unique place in Indy. The interior is well laid out and well designed. I like the marble tables and the window to watch the bakers make the cakes. My experience was great. First, I had a smores mocha. I had a quiche (rosemary & ham) for lunch. For dessert, I got the millionaires cake. The millionaires cake had just the right amount of caramel and chocolate. Overall 10/5 experience!","2016-08-09 01:05:33"
"kRd2YHgoLjrXSnC-4j9PWQ","UtmsHIyNNgeVZlm6CYLWjA","SZU9c8V2GuREDN5KgyHFJw",3,1,0,0,"This place was the only place with a lot of stars and over 600 yelpers were on board stating it was good...

Unfortunately this place was simply okay. There is a sign in sheet by the door and the place is a small restaurant and maybe a five table seating outside, inside seemed crowded.

After standing there I noticed a side window and tables across the way, felt that we were hungry and really didn't want to wait.

Went with the shrimp and scallop pasta dish with linguine and it wasn't outstanding, it was okay. Also tried their clam chowder and the clams were non existing. 

My date tried their shrimp tacos (2) with some rice, she said they were okay, nothing great either.

Bill came out to $45 for just okay food. I for one don't mind spending on good food, but I truly felt this place was hype.

Oh well.","2014-10-13 01:54:02"
