"review_id","user_id","business_id","stars","useful","funny","cool","text","date"
"JYoy9RVBExWMWZzk66AzDw","afzj7ppLrCVMAsivTceWUA","HYK6JACOzRHk2XHUjbyJ6A",3,2,0,0,"The Food was great, but we went to this place because it had a Starbucks inside or so we thought..turns out they serve starbucks coffee- but not all starbucks drinks....like an Iced Venti Vanilla Latte... The parking was crazy. Had to park in front of the dumpsters and because of how many people were trying to find a space or get out of there, we had to exit through the drive thru.","2011-01-10 05:54:40"
"lplLGIDNDDtRDFdN6Azwlw","wiIrT3H8hVxH1QdJD6jbqQ","-rTJCKclkU_ZnoQb4oKa9w",4,0,0,0,"Local favorite. Cannot go back to Dunkin' Donuts any more! 
I like simple grazed donuts or cinnamon sugar.","2017-09-24 03:32:13"
"moYEOfbNLuRBJwSMYmo4NQ","kS1MQHYwIfD0462PE61IBw","GBTPC53ZrG1ZBY3DT8Mbcw",3,2,1,2,"they love salt in New Orleans.  another restaurant where the flavor was good but overly salty.  plus a place like this should have fresh fries but ours came out cold soggy.  so tried the famous shrimp and grits, rich heavy sauce, nice sausage but too salty.  also shared the seafood platter medium which had a nice assortment of crabs (2 types), clam, oysters (weren't sandy), mussels.","2013-11-18 13:14:53"
"3hOD-xvZmrXgHnEmbCyqvQ","dsx3wwBHtKxuer56YE-4eA","JvawJ9bSr22xn4R9oLvl_w",4,1,0,0,"I loved this spot!  My husband and I stopped in here for lunch and ended up coming back the next day.  We liked the vibe, and the people-watching on Bourbon Street is perfect.  

The oysters are delish but I really devoured the Jumbo Shrimp Remoulade.  It's served on Fried Green Tomatoes which are my favorite, and not every place offers them.  I even asked if I could buy just a small side of the tomatoes, and they whipped it up for me!  Super nice people and great service.  
xo","2015-05-16 14:41:19"
"Fi5U6Kk0hwXgox2sAc7v1g","jgOiPBwO12Pfv16nPJ8j8A","A_-Vv5oKZNqxsV69_7E2KQ",5,0,0,0,"Where the pho you been all my life!  Great food, great ambiance, great staff. Will be back soon!","2015-07-07 05:53:04"
"iMSe5V8cZdbsdseDa5k7gw","tJZnXf1mafOOEcUNd3yoiA","oThWInL6gUCt2d98fSIAfA",4,2,0,1,"A notch or two above regular pub food. Good kids menu options including PBJ with the crust cut off. No smoking. Homemade black bean burger was delicious but fell apart easily while eating. Homemade chips were a little overdone but still ok. Overall, a pretty good offering for the area, and I'll be back.","2010-07-11 01:16:53"
"XovgjBG1xk8QdZ9NIy56xw","V_ShG5JgiqOy2FFMFwpQ1A","7WZ5EGb-Xk_uxQTWc52P4w",5,0,0,0,"For the money, this is a great little diner, just make sure you bring cash because","2016-03-07 16:05:44"
"OlScmFBnkDO1H2sT1-MN6Q","Xgy0C43dV4aB7FW6kdDXeQ","wJmyu7W1K9A_gE8Ed4Bc9w",5,0,0,0,"Was in Tucson on business and the Trident Grill was recommended by the customer I was visiting.  Great food (apps and entrees), excellent selection of beers at the bar, and a very lively, fun, and comfortable atmosphere.  I don't envision in being in Tucson very often but if I ever am I will definitely eat at the Trident again!!","2017-10-12 18:35:49"
"a5grEdgQf4Yvkz6eBBKd-g","35cOtsnGyXJFkKCrmdW7Xg","g04aAvgol7IW8buqSbT4xA",4,0,0,0,"Stopped here for breakfast recently and the food was damn good.

I had a mango mimosa with breakfast and it was great, it didn't taste like they were using the cheapest champagne but something quality. My shrimp and grits were absolutely excellent, almost as good as NOLA.

Service was a bit slow and the table and chairs are uncomfortable but the food makes up for it.","2014-09-10 19:32:59"
"aTBPxEhPMZq9cHwLwqJqIQ","9ix2dVwfFePzKqNMRZwexg","6LyhttbsQn6a6PDxQDojCw",5,2,0,0,"This review is for the Sushi and the service.  Both are outstanding!  The fish is very fresh and the rolls are as beautiful as they are delicious.  I have celiac disease so I must eat gluten free.  The sushi chefs here show a great deal of interest and care in making sure I am able to eat safely.  This restaurant has gluten free soy sauce available as well as gf soy paper.  This is fantastic because I dislike seaweed paper but rice paper often contains gluten.
Baylor (my favorite sushi chef) takes great pride in his skill and service.  Night after night, he genuinely seems to enjoy creating versions of rolls that are safe for me to eat and that he knows I will like.  In fact, every employee I encountered bent over backward to give great service and demonstrate they understood my special dietary needs and remembered what I like and how I like it.  I feel very welcome there.
Too often, restaurants offer a ""gluten free menu"" which is really just a list of items from the regular menu made without this or that; usually the best part of the recipe is missing leaving just a slab of plain, sauceless meat or worse, a plain salad.  Not so at the Tokyo Japanese Steak House sushi bar.  
I had heard that another local sushi bar was better so I tried it.  I did not review that restaurant because I don't enjoy writing negative reviews.  The sushi was fishier, the service was ""bored"" the counter wasn't clean and in spite of other reviews I have read, Tokyo charged less for the items I ordered.
A final note: Google maps shows the location as President Place and Jim Parker Dr. but it is actually in a strip mall on the corner of President Place and Potomac.
Go and enjoy!  And if you want gluten free, ask for Baylor and tell him Cindi from California sent you!","2012-07-20 03:57:33"
"-shP0Ch9yjTvWXY_Lvg6Lw","XOy21vQ4MBQhF_VmmNn8jA","v72HalBu5fQIFTD-oqhSgQ",5,0,0,0,"Incredible food and service !  We had steak and lobster.  We have been here twice and have loved it both times!","2015-07-05 23:37:25"
"lL9yfg54rHEt3P9nxnCrhA","Vy1GqxsjwjegS-A61o8KZQ","FsRAHiYUERqUIeGVt49svA",3,0,0,0,"I am always rooting for Qdoba. I think the toppings (bbq sauce and queso) should give it a real edge over Chipotle. But for some reason, it just never feels better.

The ambiance is ok, but its more fast food than fast casual. The staff is friendly. Food execution is consistent, but the food in general lacks the zest and freshness of a Chipotle.

I would not hesitate to eat here if I needed something real quick, but I wouldn't go out of my way.","2013-10-10 01:05:40"
"NJjmjAxfIFld4NcWaq2HaA","z0nqxL5PumE5qcJSlQac0Q","sB45WFgysT617bKWP_WJwA",5,0,0,0,"This is a must-see attraction in St. Louis!  My family and I took their free tour, which is a walking tour about 45 min long. We got to learn how they make beer, visit the Clydesdales in the stables, sample a Budweiser or Bud Light and at end drink more beer in their Biergarden (including one free 16 oz beer). Soda is free in the Biergarden. I was amazed at the history there and our tour guides were funny and very entertaining. Definitely worth a trip to visit this classic brewery which is a part of our American culture.","2016-05-22 00:29:05"
"c2ZsH81xojKZ_8OgLciMGA","OoRovBJbcvItbTC0q02yfg","qdpdUjdkEUpzYDdce2yZng",5,0,0,0,"I come here every week , best sandwich place in town , and great price! Love the the friendly costumer Service.","2017-05-13 20:28:00"
"xabEJ9ohG-LiHOWThD30Yw","Vq2rKjqRFV1P7Jy9f1Gh0Q","4y5nCB6NWXRpjL8Spo1iuw",5,0,0,0,"AWESOME AWESOME FOOD!!!!   Have been going here for a few years...Do not judge a book by its cover...burgers are great, pulled pork on long roll great...entrees are great...Great tap beer selection...You need to get here for lunch or dinner!!!","2016-12-22 03:02:33"
"-GbnAnXtVwztcjPwjvIGcw","ZTF_J0E8jV-tCDmtVKCSsQ","hDVpw1PSS31uFUCOsI-eog",3,0,0,0,"We've been going here for years but over the last 6 months its been a downhill slide. The service has become inept.. Slow and sometimes painful to watch. Management seems to have a problem hiring competent staff or keeping thdm once they are trained. The food is almost always good but not a bargain unless you use a Restaurant.com coupon.
Decent happy hour drink prices.
I just wish they could train the staff better.","2016-02-11 23:33:46"
"JppBfMoyid1t7pOAw65Yqw","e1T7iT5uXUw4D8UqUkadRQ","xwSWtJcQkzTF6HNm_IMgcg",2,0,0,0,"The delivery would bring me the wrong pizza and of course it's with the 2 toppings I despise the most. Just my luck. #alwayscheckyourpizza #whatsinthebox","2015-04-29 05:47:09"
"tbK0wmDORfFZ0BY9byGulQ","ZEW6JVD6HVn6izMq-Ea1aw","cg4JFJcCxRTTMmcg9O9KtA",2,0,0,0,"This is a lovely restaurant, but unfortunately they did not have a wide enough selection for me.  Not enough vegetable options on the menu.  I will try the kale pizza and give them another try in the future.  The Moscow mule was awesome!","2015-05-01 19:21:20"
"tlpcBK06iS9qayn_Z5gbsQ","6lmqSrwSrhTcjNwTEiQZPg","5NSA0-aOjOVQWJYIr8hA-Q",4,3,2,2,"If you ever want basic chili with gobs of cheese, a touch of crunchy onions, and a side of white bread with American grilled cheese, come to Dot's. All this and 5 packets of saltines can be yours for $5. I quite enjoyed scarfing this down after I got my brake tag across the street at Keith's. This location seems less crowded at lunch than the one closer to Ochsner. Fast, easy and greezy!","2011-12-09 22:48:32"
"K0zrpyMtMw7vdTpxxFr0wg","rUVrPCEeZAWZeEfG-mhVrg","I0jFTYVDs-WHwKR2XHQlRA",5,0,0,1,"Hands down the best Thai in SB, with some of the friendliest service you will ever find.  Our family eats here every Tuesday after the farmer's market, and the staff is so warm and welcoming it is like coming home.  They are always sweet to the children, and remember everything about us even when we have been gone for weeks due to travel or bad weather.  The food is also exceptional (Poor Man's Noodles with pork is my ATF), and fresh specials are a nice treat.  Finally, the food is consistently good, which is an area many restaurants in SB fall down on...  So for great food, great service, and reasonable pricing, stop by Zen Yai.","2011-08-03 05:07:20"
"RSER1sCejZAYIIEWBhc4KA","XjDgwwXHe-ZutVkB_ODh9w","NKnwvuJygWPC42qycr6Hwg",5,0,0,1,"Totally off the charts! This place is outstanding. Everything that makes a restaurant good is here. Great food, great prices, great service, chilled out atmosphere. Try the roast beef gravy fries (i think its called debris fries) and roast beef poboy. Also try the hamburger steak dinner. Oh i need to mention their very good seafood platter. I hear their breakfast is good too but I have not tried it yet. So the bottomline is im sold on this place.","2017-04-22 00:34:32"
"3MvNbgy8FTRTglE8Xhl0Gg","UhcJoeuMWJae2pcKCm0t0A","-o6bah2j6_IH9pkwANXcLA",5,0,0,0,"BEST PIZZA EVER!!  I love this place. The pizza is amazing, the sangria is to die for, and the staff is friendly and attentive. My husband loves the selection of micro brews on tap. If you haven't tried the wood fired pizza there yet, you MUST stop in.  And if they have broccoli pinwheels listed on the chalk board, don't pass them up!","2012-12-09 01:21:08"
"wwtY0by2rPm9Cm2iVe3G8w","GuL-RZfMTd_SXaT_7HSgmA","JTM0CtxIIV8B9IEN8t4Plg",1,9,5,0,"Do not waste your time. I received calls that my furniture was ready multiple times when it was not, when my order finally came, it was NOT what I ordered and I had to wait AGAIN,  more than a month too. Barely a year later and now it is falling apart and the pillows I paid too much for are flat too. I am appalled that they can charge so much when they give so little. 
I love the idea of being able to customize, but it was not worth it in any way.","2011-02-22 21:49:59"
"zzC2HoaeSs4n5-3C3mpJvw","265EYpe5vbp5omrIObdpFg","N5ekxQd7wGHWJJK-p9qqXw",2,1,0,0,"We didn't really have a good experience at this place . To start with we had to wait about 30 min in spite of a reservation . And then we were seated in a back room next to a very noisy and drunk group of girls . Not the restaurants fault - but they could have seated us someplace else. The menu was extremely limited - with a very dew options to pick from. I got the mushroom pizza - which wasn't anythibg great . My husband and another friend ordered the lamb entree and they weren't impressed either. Another friend ordered their margarita pizza and that was probably tge best thjbg on the table.
I`d rather go eat at saint anejo across the street for much less money and wait ! This was disappointing","2014-06-30 00:16:41"
"w9UqNsoJbOBZhz-J7L62hA","Ie6pYfYtrbxsc95FnonYdw","PY9GRfzr4nTZeINf346QOw",5,0,0,0,"great place to stay when in reno. besides the fact that i was electrocuted after the fire alarm went off at 3 am. but they made that right and comped my stay and gave me resorrt crdits to use on my stay. i do believe this was a one time offence that could of happedn to any one.","2014-06-12 01:23:13"
"1NFE1R5f-B_rCyEAm-5vww","SVqcdr8KR0Pewa8XT1113g","SFeFOaqo7d0DvNmMXzY0XQ",5,0,0,0,"Friendly staff and good pizza. Alex took his time to make the perfect gluten-free pizza!","2016-06-23 22:52:53"
"Q-z2b4gMXTgTzAmPn2X3vQ","-bNDlp4kGX3rlQmPD09XwA","0hIXH9jMdHov1VrLC8ujUg",4,0,0,0,"A great BBQ option has arrived in Ybor.  Do not leave without trying the baked beans!","2009-05-31 15:59:59"
"FgVmH3PpCnNmBk2JTOuweQ","ZNmNHR98-cv5HvJXKtYSng","KfMT4o2JNoR2Ma0OtCJ5rQ",3,0,0,0,"Great price, which is why a lot of people probably choose retro, however, this one is really small and especially tight in the weight area. I often find myself waiting for equipment, if you squat you'll always have problems getting in the (1) rack available for squats. Bro, please don't curl in that rack. Ugh.

Recently they have banned dead lifts. It's turning into a Planet Fitness, which is cheaper and probably a better choice if you don't need the squats or dead lifts.

Cardio area seems to be OK in terms of amount of equipment, though some is in pretty bad shape. Plastic pieces missing, dirty, etc.

Men's bathroom is in pretty sad shape. The sink area looks terrible.

I most likely will join elsewhere when my contract is up, but the location is great, so that's a bummer.","2015-01-19 03:07:17"
"M30TD7RSvxFmsvLS8SMObA","qGaS0uufFI4Jq2hPbPQIXg","Jx2AoB_IQOUrZ3s6fdAUSA",5,0,0,0,"First time ever and I'm completely impressed! Used the drive-thru due to a sleeping baby, and although there were a couple cars waiting, I was quickly greeted by someone actually walking outside to take my order! Since this was my first time, he gave me a few recommendations upon request. Chose the white pumpkin latte and I'm officially a chain-addict convert! The flavors were well balanced and delicious, without that burnt taste of another unmentioned chain that I was formerly a huge fan of. And I can't make it through fall without my pumpkin spice! Customer service is exceptional and the coffee is great, I'll be back!","2013-09-19 12:31:05"
"7pj0kZ2J53DJQ-6Hs6oypg","K0AAwOYOmFS1Oy1gYP8yjA","gq4zw-ru_rkZ2UBIanaZFQ",1,1,0,0,"You get to wait 20 minutes even when first in line at the drive thru window. Now worth it - even of their fries are die-worthy!","2014-02-25 04:49:19"
"LMxWQtQB8YaekB8VU9aQHQ","s16-BUo-orUsELvMu5ocKg","EtKSTHV5Qx_Q7Aur9o4kQQ",3,0,0,0,"Eh....Let's just say I'm glad this was not my only Jose Garces stop for the weekend.

The best thing about this place is the music. Absolutely awesome rock from the 60s, 70s and 80s. Tunes you know, tunes that sound like the hot sisters of tunes you know, tunes that take you back to when you played doctor with a Fisher Price stethoscope--yeah, music like that. I definitely did my fair share of Shazaaming and ""I gotta go back and listen to that album""-ing.

The food itself was pretty mediocre. The boy and I did a weekend-long food tour of Philly and this was stop #65 or so, so we weren't extremely hungry coming in.

We came for the duckfat fries. But, well, they looked and tasted like normal fat fries except possibly on the drier side. The cheddar sauce helped a lot but I love french fries and believe good fries taste good without condiments of any kind, so the cheddar sauce wasn't too comforting to my fry-loving soul. We then split the chicken-fried steak. Holy oversalted batter, Batman! Waayyyy too much salty batter, about 0.23g of actual chicken. The gravy was okay but nothing remarkable and the biscuits were tender but too dense.

I did love my cocktail, though. Got the Philadelphia Fish House Punch and it was a good, strong, sweet cocktail. Between that and the frat boy/bachelor party table next to us, I had a pretty good time here but definitely won't be coming back next time I'm in the city of brotherly love.","2010-07-08 19:18:12"
"PqGnnBi0QZvO9gtcPA7pNQ","LNx8acQ5UMJ4psE9CV1cww","2YTJa7DDWx2TQmHu-tPXlg",5,0,0,0,"Day tripped it from LA with the family. My preschooler loves loved loved this museum. She didn't want to leave!! Easy parking at the Amtrak station next door. I believe it is free for the first 75 minutes and then 1.50 an hour after that. We bought our tickets online and walked right in. The wristband given has in/out privileges for the day, which worked out wonderfully. We spent the morning exploring all three floors. Finally convinced the preschooler to grab lunch next door with the promise that we would come back right after lunch. Which we did and proceeded to explore and play and learn for another couple of hours before we bribed her to leave with the promise of ice cream! There are three floors to explore, all with fantastic, interactive exhibits. We had as much fun as she did. Even on a summer Sunday, it wasn't overly busy which was surprising, but it made for a very pleasant experience. Highly recommend!","2017-08-29 05:25:46"
"F25_tY-I7TccRvfdVEuaKw","Tys-LkUZLtVtN2Yl5om2Qw","FHNIvNgh3fS7VZQq2Y3dsA",4,2,0,0,"Everything here is exceptional.  The only obstacle standing in the way of me giving Cheu 5 stars is their slightly hefty price tag.  A bowl of Ramen, no matter how exceptional it may be (and everything here IS) shouldn't cost upwards of $15.  That being said, it is absolutely worth every filthy cent.

Although truly everything is incredible, your order for 2-4 people should consist of:
1 pork belly bun
1 mushroom bun
special dumplings of the day
black garlic wings
sour broth- pork ramen with a pork belly and egg ad-on
Miso Ramen
Hand torn- with lamb's neck and an add-on egg

If you're an industry monkey like me, go on Mondays, they give an industry discount!  Great fellows doin' great food.  Beer selection could improve a little, but it's satisfactory overall.","2014-08-26 16:23:46"
"TAyxB_PETsutqzke5iWROg","7ZSGT3StO75gqUI3OTU1xg","Qbxo9pb5yDsbD3GSuzYOjQ",4,0,0,0,"Went there when they were West Side Gravy and had the best burger of my life. Since then, they are under new management and renamed. Several of the menu items are the same but the burger is not as great. They have some gimmicky burgers like one between 2 Krispy Kreme doughnuts or between 2 pbj sandwiches --- good luck with those.","2013-08-17 16:15:14"
"cz8S5j-VhbSpSKx642g0sw","4_b8kewGkLvIykZCZ-V8Ag","pSmOH4a3HNNpYM82J5ycLA",3,2,0,0,"After waiting days to go because of the ridiculously long line (over a block long) it was finally a delicious meal I was able to enjoy. However, service was so cold and inhospitable. Almost keeps me from returning again, but the waffle I ate was just too delicious.","2013-02-25 02:14:07"
"h9qMp3zAckX3A-Qen5M7TQ","qA_8SkGk6ub8nTjoY1q6Cw","unc52U31YIybi7Zi2UhSdg",4,1,4,2,"The Wellington holds a special place in my heart.  I want to carve it (the welly, not my heart) out and put it on the corner at the end of my street.  Sure I'll make the trek up every so often for a visit, but Broad Ripple really isn't my scene... I'd rather eat an entire bag of cool ranch doritos in my underwear while watching any CBS sitcom than spend a weekend evening there. 

Luckily they have pint nights on Tuesday and Wednesday night (the slowest and least annoying evenings in BR) -- Rejoice! ($3.50 pints I believe) 

A warm and cozy enclave with old school dart boards and front door that reads ""Public Bar.""  Throw in an excellent regional craft beer list and we are nearing perfection. My only real issue is the allowance of smoking, but hell.. I'll deal with that every now and then.","2012-01-04 05:41:45"
"erCLLd59DkF1_aggTlIyiA","LE8--hxOqaeCPs1MxfEpKQ","D3DMIr-I0AKzlIKdErxHGg",4,1,0,0,"We had a lovely brunch on a cold, rainy Sunday. The staff was extremely friendly, the atmosphere was bright and classy, and the food was delicious. We will definitely try Nathalie's again, next time for dinner!","2015-02-02 22:09:51"
"3dOI0WlXTLzJeLCYT4v44Q","ZSaUHXG6NVL37dXkfgSNnQ","_aKr7POnacW_VizRKBpCiA",4,0,0,0,"Good.  Not great.  Based on a friend's reccomendation i stopped here today.  Unfortunately for me almost every sandwhich he suggested has pork on it,  which I avoid.  I chose his non-pork recommendation, Italian beef.  While the sandwhich was very good, its not quite as good a those in Chicago.

Good: lots of meat, essential toppings were there (peppers, celery, carrots and peppers).

Bad: while I  like my sandwich dipped I prefer the dip, meat and bread seperated when the sandwich is to go.  

I felt compelled to eat it in the car ride home before bread was too moist.  
With all that said I will more than likely return.","2017-06-09 23:10:05"
"hVGYlpUcCarD3P6gZYtbvg","nG5xB2FSqiDPzNn20aVSow","196CWwMAtAcA21jYiMyRzg",3,0,0,0,"Average food, great location, small portion sizes and slightly higher prices. Move on peeps.","2017-01-05 02:56:27"
"CUYXVhAZhlrE3QD8LS54dQ","g3dB7gYneCWAfx3K3_80CQ","25btSWnOGwwB2IQMXF7A-A",5,1,0,0,"i do nearly all of my grocery shopping here, it's more than worth the drive from Claymont. We have cut down significantly on our grocery bill since we started doing so. Their meat is a bit pricey, but we more than make up for it by the low prices of their frozen fish, produce and dairy, even organic! I also love their housewares and personal care items; I get my shampoo and body lotion here, and my laundry detergent, dishwashing soap, and dishwasher powder, even cardboard scratchers for my cat! So reasonable! They have all the basics plus tasty novelties exclusive to TJs for when we want a treat. It can get crowded on the weekends, which can be overwhelming, but the staff always takes it in stride and is always friendly and helpful. I dread the thought of moving away from here!","2017-01-17 21:49:07"
"JSKydL1xduESCDlNruiXAA","o51h2nzG9t39lE00faD_XA","rQ2CSHRkZSn5WCu7OfVI-Q",5,0,0,0,"Brought my daughter in today for her yearly check up with Dr. Dinh. We followed him from another location. Great doctor and professional staff. I love his new location! Very open space, clean, and up to date on all his new equipment. Definitely recommend this location!","2014-09-12 23:49:44"
"DFrIPhg5ZJRE9fCv6cEqkw","UNOZ6-juN1ZLFt9uf6urOw","pym7c6ZFEtmoH16xN2ApBg",3,1,0,0,"It looked like they had some good things on the menu, but I wasn't a huge fan of my cocoon de lait and shrimp po boy or the garlic feta fries.","2012-10-11 17:16:15"
"ZX0nBxPFx1zgB6h7_TObGg","2uzH6U_kGVOBIIJoZOOUPw","uwF2zLAnZZ1SCwEF8QQKQA",5,3,7,3,"Ah, Wissahickon Trail ... I want to set up a tent and live on you forever. Seriously, you made me forget all about the screaming kids from my neighborhood, the wretched stench of the city on a hot day and, well, pretty much anything else discomforting about city life.

What more could I ask for from a life partner?","2009-05-22 15:44:35"
"zG8iOfbAABIYelR2IwrV9A","wTmSVi8InHeNC1_O8aZxYQ","zIUUlBoQOQqQLoi2ElcWAg",5,0,1,0,"Hands down best Gourmet Mexican and tequila bar in town! Food is fresh and cooked to order. Chicken tacos out of this world! Carne Asada tacos are mouthwatering.  Handcrafted margaritas made with fresh lime juice and no bottled sour mix. El Jeffe is our favorite...Don Julio, lime juice, agave, and a splash of Grand Marnier. Perfect!  Enjoy live music on the patio Friday and Saturday nights. Fabulous Sunday brunch too!","2018-04-28 02:28:31"
"utjG1-y0BypkZEwqCYqYrA","BZt_bNerwUdog0TRglGS5A","-OIUunijjcq_ZzyyQhPPFQ",5,0,0,0,"I've been going to Zorba's for greek food for as long as I can remember.  I'm greek and anytime that we feel like going out instead of cooking, we go to Zorba's.  The family who owns it is really nice and the food they serve is quality.  I really enjoy the grilled octopus and the saganaki.  This place reminds me of the traditional tavernas you can find in Greece.  The outside seating is really nice when its nice out and the service is always great!","2010-04-05 15:26:43"
"IN4Wvv3DbxKu3wvUrv2T4A","_Xod7ll-OdnoPPvtPA6rqw","VZFQS0SXzXPuxISbAgIVBA",2,0,0,0,"Sadly, 'feine went downhill fast.  At first it was such an adorable, pleasant cafe but now it seems like they don't care about the customer's experience.","2016-01-31 13:23:05"
"v5_yXQefMNUf9wXzIfsF-w","NcEAlgu_yIjtkY4DesBGMg","fMOVZ-u5IqfJ-lNOCLVm7g",3,3,1,1,"This restaurant is off to a shaky.  The server did not check on the table until I called them.  In fact anybody never checked my grill n notice we did not receive ssamjang.  Lots of meat that hasn't been marinated.  I hope going to be better than today","2018-03-05 03:07:08"
